id,post_title,seo_title,meta__yoast_wpseo_title,seo_description,meta__yoast_wpseo_metadesc
https://www.bobvila.com/articles/best-table-saw-fences/,The Best Table Saw Fences,The Best Table Saw Fences (2024) %%sep%% Picks from %%sitename%%,The Best Table Saw Fences (2024) %%sep%% Picks from %%sitename%%,,
https://www.bobvila.com/articles/best-dewalt-table-saws/,The Best DeWalt Table Saws You Can Get,The Best DeWalt Table Saws You Can Get %%sep%% Picks from %%sitename%%,The Best DeWalt Table Saws You Can Get %%sep%% Picks from %%sitename%%,,
https://www.bobvila.com/articles/best-cordless-grass-shears/,"The Best Cordless Grass Shears, Tested","The Best Cordless Grass Shears, Tested - Top Picks from Bob Vila","The Best Cordless Grass Shears, Tested - Top Picks from Bob Vila",,
https://www.bobvila.com/articles/best-leaf-removal-services/,"The Best Leaf Removal Services, Vetted",The Best Leaf Removal Services (2024) - Picks by Bob Vila,The Best Leaf Removal Services (2024) - Picks by Bob Vila,,
https://www.bobvila.com/articles/best-countertop-oven/,The Best Countertop Ovens You Can Get,The Best Countertop Ovens You Can Get %%sep%% Picks from %%sitename%%,The Best Countertop Ovens You Can Get %%sep%% Picks from %%sitename%%,,
https://www.bobvila.com/articles/best-range-hoods/,"The Best Range Hoods, Reviewed","The Best Range Hoods, Reviewed - Picks by Bob Vila","The Best Range Hoods, Reviewed - Picks by Bob Vila",,
https://www.bobvila.com/articles/best-water-filter-pitcher/,The Best Water Filter Pitchers,The Best Water Filter Pitchers - Top Picks by Bob Vila,The Best Water Filter Pitchers - Top Picks by Bob Vila,,
https://www.bobvila.com/articles/best-carpet-sweeper/,"The Best Carpet Sweepers, Tested",The Best Carpet Sweepers -Tested by Bob Vila,The Best Carpet Sweepers -Tested by Bob Vila,,
https://www.bobvila.com/articles/best-ceiling-tv-mount/,The Best Ceiling TV Mounts,The Best Ceiling TV Mounts - Picks from %%sitename%%,The Best Ceiling TV Mounts - Picks from %%sitename%%,,
https://www.bobvila.com/articles/best-outdoor-christmas-light/,The Best Outdoor Christmas Lights,The Best Outdoor Christmas Lights - Picks from Bob Vila,The Best Outdoor Christmas Lights - Picks from Bob Vila,,
https://www.bobvila.com/articles/best-bathroom-heaters/,,The 9 Best Bathroom Heaters - Reviewed by Bob Vila,The 9 Best Bathroom Heaters - Reviewed by Bob Vila,,
https://www.bobvila.com/articles/best-plunge-router/,"The Best Plunge Routers, Tested and Reviewed","The Best Plunge Routers for Workshops, Tested - Bob Vila","The Best Plunge Routers for Workshops, Tested - Bob Vila",,
https://www.bobvila.com/articles/best-hard-hats/,"The Best Hard Hats, Tested and Reviewed","The Best Hard Hats, Tested & Reviewed %%sep%% Picks by %%sitename%%","The Best Hard Hats, Tested & Reviewed %%sep%% Picks by %%sitename%%",,
https://www.bobvila.com/articles/best-stick-welders/,"The Best Stick Welders, Reviewed","The Best Stick Welders, Reviewed %%sep%% Picks from %%sitename%%","The Best Stick Welders, Reviewed %%sep%% Picks from %%sitename%%",,
https://www.bobvila.com/articles/best-sanders-for-hardwood-floors/,The Best Sanders for Hardwood Floors,The Best Sanders for Hardwood Floors %%sep%% Picks by %%sitename%%,The Best Sanders for Hardwood Floors %%sep%% Picks by %%sitename%%,,
https://www.bobvila.com/articles/best-sandblasters/,The Best Sandblasters,The Best Sandblasters - Picks from Bob Vila,The Best Sandblasters - Picks from Bob Vila,,
https://www.bobvila.com/articles/best-rollaway-bed/,The Best Rollaway Beds of 2024,The Best Rollaway Beds of 2024 - Bob Vila,The Best Rollaway Beds of 2024 - Bob Vila,,
https://www.bobvila.com/articles/best-dewalt-miter-saws/,The Best DeWalt Miter Saws You Can Get,The Best DeWalt Miter Saws You Can Get %%sep%% Picks from %%sitename%%,The Best DeWalt Miter Saws You Can Get %%sep%% Picks from %%sitename%%,,
https://www.bobvila.com/articles/best-miter-gauge/,"The Best Miter Gauges, Reviewed","The Best Miter Gauges, Reviewed - Picks from Bob Vila","The Best Miter Gauges, Reviewed - Picks from Bob Vila",,
https://www.bobvila.com/articles/best-undercounter-refrigerators/,The Best Undercounter Refrigerators,The Best Undercounter Refrigerators %%sep%% Picks from %%sitename%%,The Best Undercounter Refrigerators %%sep%% Picks from %%sitename%%,,
https://www.bobvila.com/articles/best-mulching-lawn-mowers/,The Best Mulching Lawn Mowers of 2024,The Best Mulching Lawn Mowers of 2024 %%sep%% Picks from %%sitename%%,The Best Mulching Lawn Mowers of 2024 %%sep%% Picks from %%sitename%%,,
https://www.bobvila.com/articles/best-gas-cooktop/,"The Best Gas Cooktops, Reviewed","The Best Gas Cooktops, Reviewed - Picks by Bob Vila","The Best Gas Cooktops, Reviewed - Picks by Bob Vila",,
https://www.bobvila.com/articles/best-battery-tester/,The Best Battery Testers,"The Best Battery Testers for Lawn Equipment, Motor Vehicles, and More - Bob Vila","The Best Battery Testers for Lawn Equipment, Motor Vehicles, and More - Bob Vila",,
https://www.bobvila.com/articles/best-chimineas/,The Best Chimineas of 2024,The Best Chimineas of 2024 - Bob Vila,The Best Chimineas of 2024 - Bob Vila,,
https://www.bobvila.com/articles/solo-stove-accessories/,The Best Solo Stove Accessories,The Best Solo Stove Accessories - Bob Vila,The Best Solo Stove Accessories - Bob Vila,,
https://www.bobvila.com/articles/best-bidet-toilet-seats/,,The 8 Best Bidet Toilet Seats - Reviewed by Bob Vila,The 8 Best Bidet Toilet Seats - Reviewed by Bob Vila,,
https://www.bobvila.com/articles/best-space-heater-for-bedroom/,The Best Space Heaters for Bedrooms,The Best Space Heaters for Bedrooms (2024) - Bob Vila,The Best Space Heaters for Bedrooms (2024) - Bob Vila,,
https://www.bobvila.com/articles/best-cutting-board-oil/,,Maintain Butcher Block With the Best Cutting Board Oils,Maintain Butcher Block With the Best Cutting Board Oils,,
https://www.bobvila.com/articles/best-home-tool-kit/,"The Best Home Tool Kits, Tested and Reviewed",The Best Home Tool Kits - Tested by BobVila,The Best Home Tool Kits - Tested by BobVila,,
https://www.bobvila.com/articles/best-pool-accessories/,The Best Pool Accessories,The Best Pool Accessories - Bob Vila,The Best Pool Accessories - Bob Vila,,
https://www.bobvila.com/articles/best-lg-dishwashers/,The Best LG Dishwashers You Can Get,The Best LG Dishwashers You Can Get %%sep%% Picks from %%sitename%%,The Best LG Dishwashers You Can Get %%sep%% Picks from %%sitename%%,,
https://www.bobvila.com/articles/best-dishwashers-under-500/,The Best Dishwashers Under $500,The Best Dishwashers Under $500 - Picks by Bob Vila,The Best Dishwashers Under $500 - Picks by Bob Vila,,
https://www.bobvila.com/articles/best-pest-control-in-alexandria/,"The Best Pest Control Companies in Alexandria, Virginia","The Best Pest Control in Alexandria, Virginia - Picks by Bob Vila","The Best Pest Control in Alexandria, Virginia - Picks by Bob Vila",,
https://www.bobvila.com/articles/best-welders-for-beginners/,The Best Welders for Beginners,The Best Welders for Beginners %%sep%% Picks from %%sitename%%,The Best Welders for Beginners %%sep%% Picks from %%sitename%%,,
https://www.bobvila.com/articles/best-freeze-dryers/,"The Best Freeze Dryers, Vetted","The Best Freeze Dryers, Vetted %%sep%% Picks by %%sitename%%","The Best Freeze Dryers, Vetted %%sep%% Picks by %%sitename%%",,
https://www.bobvila.com/articles/best-tiny-home-builders/,The Best Tiny-Home Builders in America,The Best Tiny Home Builders in America - Picks by Bob Vila,The Best Tiny Home Builders in America - Picks by Bob Vila,,
https://www.bobvila.com/articles/best-detail-sander/,"The Best Detail Sanders, Tested and Reviewed","The Best Detail Sanders, Tested & Reviewed - Bob Vila","The Best Detail Sanders, Tested & Reviewed - Bob Vila",,
https://www.bobvila.com/articles/best-garden-kneelers/,The Best Garden Kneelers,The Best Garden Kneelers %%sep%% Picks by %%sitename%%,The Best Garden Kneelers %%sep%% Picks by %%sitename%%,,
https://www.bobvila.com/articles/best-outdoor-projector-screen/,The Best Outdoor Projector Screens,The Best Outdoor Projector Screens %%sep%% Picks from %%sitename%%,The Best Outdoor Projector Screens %%sep%% Picks from %%sitename%%,,
https://www.bobvila.com/articles/best-hybrid-table-saws/,"The Best Hybrid Table Saws, Reviewed","The Best Hybrid Table Saws, Reviewed %%sep%% Picks by %%sitename%%","The Best Hybrid Table Saws, Reviewed %%sep%% Picks by %%sitename%%",,
https://www.bobvila.com/articles/best-online-fabric-stores/,The Best Online Fabric Stores Today,The Best Online Fabric Stores Today - Picks by Bob Vila,The Best Online Fabric Stores Today - Picks by Bob Vila,,
https://www.bobvila.com/articles/best-outdoor-towel-racks/,The Best Outdoor Towel Racks,The Best Outdoor Towel Racks %%sep%% %%sitename%%,The Best Outdoor Towel Racks %%sep%% %%sitename%%,,
https://www.bobvila.com/articles/best-grow-tents/,The Best Grow Tents,The Best Grow Tents %%sep%% Picks from %%sitename%%,The Best Grow Tents %%sep%% Picks from %%sitename%%,,
https://www.bobvila.com/articles/best-jump-starter-with-air-compressor/,"The Best Jump Starters With Air Compressors, Tested","The Best Jump Starters With Air Compressors, Tested - Picks by Bob Vila","The Best Jump Starters With Air Compressors, Tested - Picks by Bob Vila",,
https://www.bobvila.com/articles/best-air-compressor-for-home-garage/,The Best Air Compressors for Home Garages,The Best Air Compressors for Home Garages %%sep%% Picks by %%sitename%%,The Best Air Compressors for Home Garages %%sep%% Picks by %%sitename%%,,
https://www.bobvila.com/articles/best-pocket-chainsaw/,"The Best Pocket Chainsaws, Tested",The Best Pocket Chainsaw Options - Bob Vila,The Best Pocket Chainsaw Options - Bob Vila,,
https://www.bobvila.com/articles/best-circuit-breaker-finder/,"The Best Circuit-Breaker Finders, Tested and Reviewed","The Best Circuit Breakers, Tested & Reviewed %%sep%% Top Picks from %%sitename%%","The Best Circuit Breakers, Tested & Reviewed %%sep%% Top Picks from %%sitename%%",,
https://www.bobvila.com/articles/best-smart-blinds/,"The Best Smart Blinds and Shades, Reviewed","The Best Smart Blinds, Reviewed - Picks from Bob Vila","The Best Smart Blinds, Reviewed - Picks from Bob Vila",,
https://www.bobvila.com/articles/best-pest-control-companies-in-arizona/,The Best Pest Control Companies in Arizona,The Best Pest Control Companies in Arizona - Picks by Bob Vila,The Best Pest Control Companies in Arizona - Picks by Bob Vila,,
https://www.bobvila.com/articles/best-kitchen-sinks/,The Best Kitchen Sinks,The Best Kitchen Sinks - Top Picks by Bob Vila,The Best Kitchen Sinks - Top Picks by Bob Vila,,
https://www.bobvila.com/articles/best-samsung-refrigerators/,The Best Samsung Refrigerators,The Best Samsung Refrigerators - Bob Vila,The Best Samsung Refrigerators - Bob Vila,,
https://www.bobvila.com/articles/best-air-duct-cleaning-services/,The Best Air Duct Cleaning Services in America,The Best Air Duct Cleaning Services in America - Bob Vila,The Best Air Duct Cleaning Services in America - Bob Vila,,
https://www.bobvila.com/articles/best-kitchenaid-attachments/,The Best KitchenAid Stand Mixer Attachments to Shop,The Best KitchenAid Mixer Attachments - Bob Vila,The Best KitchenAid Mixer Attachments - Bob Vila,,
https://www.bobvila.com/articles/best-carbon-steel-wok/,The Best Carbon Steel Woks,The Best Carbon Steel Woks - Top Picks by Bob Vila,The Best Carbon Steel Woks - Top Picks by Bob Vila,,
https://www.bobvila.com/articles/best-herb-scissors/,"The Best Herb Scissors, Vetted","The Best Herb Scissors, Vetted %%sep%% Picks by %%sitename%%","The Best Herb Scissors, Vetted %%sep%% Picks by %%sitename%%",,
https://www.bobvila.com/articles/best-wood-chisels/,"The Best Wood Chisels, Tested","The Best Wood Chisels, Tested - Picks by Bob Vila","The Best Wood Chisels, Tested - Picks by Bob Vila",,
https://www.bobvila.com/articles/best-window-treatments-for-sliding-doors/,The Best Window Treatments for Sliding Doors,The Best Window Treatments for Sliding Doors - Bob Vila,The Best Window Treatments for Sliding Doors - Bob Vila,"We rounded up the best window treatments for sliding doors to shop. Check out our picks from Amazon, The Home Depot, and more.","We rounded up the best window treatments for sliding doors to shop. Check out our picks from Amazon, The Home Depot, and more."
https://www.bobvila.com/articles/best-air-conditioner-cover/,"The Best Air Conditioner Covers, Vetted","The Best Air Conditioner Covers, Vetted %%sep%% Picks from %%sitename%%","The Best Air Conditioner Covers, Vetted %%sep%% Picks from %%sitename%%",,
https://www.bobvila.com/articles/best-crm-real-estate/,The Best Real Estate CRM Software,The Best Real Estate CRM Software - Picks by Bob Vila,The Best Real Estate CRM Software - Picks by Bob Vila,,
https://www.bobvila.com/articles/best-rv-insurance/,The Best RV Insurance Companies of 2024,The Best RV Insurance Companies of 2024 - Picks by Bob Vila,The Best RV Insurance Companies of 2024 - Picks by Bob Vila,,
https://www.bobvila.com/articles/best-homeowners-insurance-in-florida/,The Best Homeowners Insurance in Florida,The Best Homeowners Insurance in Florida - Picks by Bob Vila,The Best Homeowners Insurance in Florida - Picks by Bob Vila,,
https://www.bobvila.com/articles/best-real-estate-books-for-beginners/,The 9 Best Real Estate Books for Beginners to Shop,The 9 Best Real Estate Books for Beginners to Shop - Bob Vila,The 9 Best Real Estate Books for Beginners to Shop - Bob Vila,,
https://www.bobvila.com/articles/best-tub-to-shower-conversion-kits/,The Best Tub-to-Shower Conversion Kits,The Best Tub-to-Shower Conversion Kits Picks from Bob Vila,The Best Tub-to-Shower Conversion Kits Picks from Bob Vila,,
https://www.bobvila.com/articles/best-floor-jack-for-trucks/,The Best Floor Jack for Trucks,The Best Floor Jack for Trucks - Top Picks from Bob Vila,The Best Floor Jack for Trucks - Top Picks from Bob Vila,,
https://www.bobvila.com/articles/best-mechanic-tool-set/,"The Best Mechanic Tool Sets, Tested and Reviewed","The Best Mechanic Tool Sets, Tested & Reviewed - Top Picks by Bob Vila","The Best Mechanic Tool Sets, Tested & Reviewed - Top Picks by Bob Vila",,
https://www.bobvila.com/articles/best-cabinet-table-saws/,The Best Cabinet Table Saws Today,The Best Cabinet Table Saws Today %%sep%% Picks from %%sitename%%,The Best Cabinet Table Saws Today %%sep%% Picks from %%sitename%%,,
https://www.bobvila.com/articles/best-manual-tile-cutter/,"The Best Manual Tile Cutters, Vetted","The Best Manual Tile Cutters, Vetted %%sep%% Picks from %%sitename%%","The Best Manual Tile Cutters, Vetted %%sep%% Picks from %%sitename%%",,
https://www.bobvila.com/articles/best-backpack-vacuums/,"The Best Backpack Vacuums, Reviewed","The Best Backpack Vacuums, Reviewed %%sep%% Picks from %%sitename%%","The Best Backpack Vacuums, Reviewed %%sep%% Picks from %%sitename%%",,
https://www.bobvila.com/articles/best-lightweight-vacuum-cleaners-for-elderly-people/,The Best Lightweight Vacuum Cleaners for Seniors,The Best Lightweight Vacuum Cleaners for Seniors in 2024 - Reviewed by Bob Vila,The Best Lightweight Vacuum Cleaners for Seniors in 2024 - Reviewed by Bob Vila,,
https://www.bobvila.com/articles/best-car-wax/,The Best Car Waxes,The Best Car Wax Options - Top Picks by Bob Vila,The Best Car Wax Options - Top Picks by Bob Vila,,
https://www.bobvila.com/articles/best-rechargeable-hand-warmer/,"The Best Rechargeable Hand Warmers, Tested","The Best Rechargeable Hand Warmers, Tested - Picks from Bob Vila","The Best Rechargeable Hand Warmers, Tested - Picks from Bob Vila",,
https://www.bobvila.com/articles/amazon-halloween-decorations/,,34 of the Best Amazon Halloween Decorations,34 of the Best Amazon Halloween Decorations,"We found the best Amazon Halloween decorations to get into the spooky spirit, including inflatables, tablecloths, candles, and more.","We found the best Amazon Halloween decorations to get into the spooky spirit, including inflatables, tablecloths, candles, and more."
https://www.bobvila.com/articles/best-pest-control-software/,The Best Pest Control Software for Businesses,The Best Pest Control Software for Businesses - Picks by Bob Vila,The Best Pest Control Software for Businesses - Picks by Bob Vila,,
https://www.bobvila.com/articles/best-grass-seed-for-shade/,The Best Grass Seed for Shade,The Best Grass Seed for Shade %%sep%% Picks from %%sitename%%,The Best Grass Seed for Shade %%sep%% Picks from %%sitename%%,,
https://www.bobvila.com/articles/best-soft-close-cabinet-hinges/,The Best Soft-Close Cabinet Hinges,The Best Soft Close Cabinet Hinges - Bob Vila,The Best Soft Close Cabinet Hinges - Bob Vila,,
https://www.bobvila.com/articles/best-gardening-stools/,The Best Gardening Stools,The Best Gardening Stools %%sep%% Picks by %%sitename%%,The Best Gardening Stools %%sep%% Picks by %%sitename%%,,
https://www.bobvila.com/articles/best-drill-bits-for-metal/,"The Best Drill Bits for Metal, Tested","The Best Drill Bits for Metal, Tested - Picks by Bob Vila","The Best Drill Bits for Metal, Tested - Picks by Bob Vila",,
https://www.bobvila.com/articles/best-bedroom-flooring/,The 9 Best Bedroom Flooring Options,The 9 Best Bedroom Flooring Options - Bob Vila,The 9 Best Bedroom Flooring Options - Bob Vila,,
https://www.bobvila.com/articles/best-door-mats-for-dogs/,,The 10 Best Dog Doormats,The 10 Best Dog Doormats,,
https://www.bobvila.com/articles/best-lawn-fertilizer-for-spring/,The Best Lawn Fertilizers for Spring,The Best Lawn Fertilizers for Spring %%sep%% Picks by %%sitename%%,The Best Lawn Fertilizers for Spring %%sep%% Picks by %%sitename%%,,
https://www.bobvila.com/articles/best-grill-gazebos/,,The Best Grill Gazebos - Picks from Bob Vila,The Best Grill Gazebos - Picks from Bob Vila,,
https://www.bobvila.com/articles/best-over-the-sill-air-conditioners/,The Best Over-the-Sill Air Conditioners of 2024,The Best Over-the-Sill Air Conditioners of 2024 %%sep%% Tested by %%sitename%%,The Best Over-the-Sill Air Conditioners of 2024 %%sep%% Tested by %%sitename%%,,
https://www.bobvila.com/articles/best-smart-toilets/,The Best Smart Toilets of 2024,The Best Smart Toilets of 2024 %%sep%% Recommendations by %%sitename%%,The Best Smart Toilets of 2024 %%sep%% Recommendations by %%sitename%%,,
https://www.bobvila.com/articles/best-table-runners/,The Best Table Runners,The Best Table Runners - Bob Vila,The Best Table Runners - Bob Vila,"We found the best table runners to help spruce up your dining room setup. Shop our top picks from Target, Amazon, Wayfair, and more.","We found the best table runners to help spruce up your dining room setup. Shop our top picks from Target, Amazon, Wayfair, and more."
https://www.bobvila.com/articles/best-bosch-dishwashers/,The Best Bosch Dishwashers You Can Get,The Best Bosch Diswashers You Can Get %%sep%% Picks from %%sitename%%,The Best Bosch Diswashers You Can Get %%sep%% Picks from %%sitename%%,,
https://www.bobvila.com/articles/best-trash-can-cleaning-services/,The Best Trash Can Cleaning Services in America,The Best Trash Can Cleaning Services in America - Picks by Bob Vila,The Best Trash Can Cleaning Services in America - Picks by Bob Vila,,
https://www.bobvila.com/articles/best-plumbing-software/,The Best Plumbing Software,The Best Plumbing Software - Picks by Bob Vila,The Best Plumbing Software - Picks by Bob Vila,,
https://www.bobvila.com/articles/best-pest-control-company-in-michigan/,The Best Pest Control Companies in Michigan,The Best Pest Control Companies in Michigan - Picks by Bob Vila,The Best Pest Control Companies in Michigan - Picks by Bob Vila,,
https://www.bobvila.com/articles/best-pest-control-companies-in-florida/,The Best Pest Control Companies in Florida,The Best Pest Control Companies in Florida - Picks by Bob Vila,The Best Pest Control Companies in Florida - Picks by Bob Vila,,
https://www.bobvila.com/articles/best-investment-property-loans/,The Best Investment Property Loans of 2024,The Best Investment Property Loans of 2024 - Picks by Bob Vila,The Best Investment Property Loans of 2024 - Picks by Bob Vila,,
https://www.bobvila.com/articles/best-floor-plan-software/,The Best Floor Plan Software,The Best Floor Plan Software - Picks by Bob Vila,The Best Floor Plan Software - Picks by Bob Vila,,
https://www.bobvila.com/articles/best-storage-ottomans/,The 12 Best Storage Ottomans,The 12 Best Storage Ottomans - Bob Vila,The 12 Best Storage Ottomans - Bob Vila,,
https://www.bobvila.com/articles/best-bolt-cutters/,"The Best Bolt Cutters, Tested","The Best Bolt Cutters, Tested - Top Picks from Bob Vila","The Best Bolt Cutters, Tested - Top Picks from Bob Vila",,
https://www.bobvila.com/articles/best-cobalt-drill-bits/,"The Best Cobalt Drill Bits, Tested and Reviewed","The Best Cobalt Drill Bits, Tested & Reviewed %%sep%% %%sitename%%","The Best Cobalt Drill Bits, Tested & Reviewed %%sep%% %%sitename%%",,
https://www.bobvila.com/articles/best-online-course-platforms/,The Best Online Course Platforms,The Best Online Course Platforms - Picks by Bob Vila,The Best Online Course Platforms - Picks by Bob Vila,,
https://www.bobvila.com/articles/best-greenhouse-kit/,The Best Greenhouse Kits,The Best Greenhouse Kits - Bob Vila,The Best Greenhouse Kits - Bob Vila,,
https://www.bobvila.com/articles/best-garage-door-screens/,"The Best Garage Door Screens, Vetted","The Best Garage Door Screens, Vetted - Bob Vila","The Best Garage Door Screens, Vetted - Bob Vila",,
https://www.bobvila.com/articles/best-birdhouses/,The Best Birdhouses You Can Get,The Best Birdhouses You Can Get %%sep%% Reviews from %%sitename%%,The Best Birdhouses You Can Get %%sep%% Reviews from %%sitename%%,,
https://www.bobvila.com/articles/best-sander-for-furniture/,The Best Sanders for Furniture,The Best Sanders for Furniture - Top Picks by Bob Vila,The Best Sanders for Furniture - Top Picks by Bob Vila,,
https://www.bobvila.com/articles/best-bench-sander/,"The Best Bench Sanders, Reviewed","The Best Bench Sanders, Reviewed %%sep%% Picks from %%sitename%%","The Best Bench Sanders, Reviewed %%sep%% Picks from %%sitename%%",,
https://www.bobvila.com/articles/best-home-remodeling-estimating-software/,The Best Home Remodeling Estimating Software,The Best Home Remodeling Estimating Software - Picks by Bob Vila,The Best Home Remodeling Estimating Software - Picks by Bob Vila,,
https://www.bobvila.com/articles/best-earthquake-insurance-california/,The Best Earthquake Insurance Companies in California,The Best Earthquake Insurance in California - Picks by Bob Vila,The Best Earthquake Insurance in California - Picks by Bob Vila,,
https://www.bobvila.com/articles/best-construction-accounting-software/,The Best Construction Accounting Software,The Best Construction Accounting Software - Picks by Bob Vila,The Best Construction Accounting Software - Picks by Bob Vila,,
https://www.bobvila.com/articles/best-earthquake-insurance-companies/,The Best Earthquake Insurance Companies,The Best Earthquake Insurance Companies - Picks by Bob Vila,The Best Earthquake Insurance Companies - Picks by Bob Vila,,
https://www.bobvila.com/articles/best-tiny-house-insurance/,The Best Tiny-House Insurance Companies,The Best Tiny House Insurance Companies - Picks by Bob Vila,The Best Tiny House Insurance Companies - Picks by Bob Vila,,
https://www.bobvila.com/articles/best-serger/,The Best Sergers,The Best Serger Sewing Machines - Top Picks by Bob Vila,The Best Serger Sewing Machines - Top Picks by Bob Vila,,
https://www.bobvila.com/articles/best-indoor-outdoor-carpets/,The Best Indoor Outdoor Carpets,The Best Indoor Outdoor Carpets - Bob Vila,The Best Indoor Outdoor Carpets - Bob Vila,,
https://www.bobvila.com/articles/best-weed-torch/,"The Best Weed Torches, Tested and Reviewed","The Best Weed Torches, Tested & Reviewed %%sep%% Top Picks from %%sitename%%","The Best Weed Torches, Tested & Reviewed %%sep%% Top Picks from %%sitename%%",,
https://www.bobvila.com/articles/best-online-real-estate-schools-in-california/,The Best Online Real Estate Schools in California,The Best Online Real Estate Schools in California - Picks by Bob Vila,The Best Online Real Estate Schools in California - Picks by Bob Vila,,
https://www.bobvila.com/articles/best-sod-installation-services/,The Best Sod Installation Services,The Best Sod Installation Services - Picks by Bob Vila,The Best Sod Installation Services - Picks by Bob Vila,,
https://www.bobvila.com/articles/best-lawn-care-scheduling-software/,The Best Lawn Care Scheduling Software,The Best Lawn Care Scheduling Software - Picks by Bob Vila,The Best Lawn Care Scheduling Software - Picks by Bob Vila,,
https://www.bobvila.com/articles/best-dishwasher-deals/,10+ Best Dishwasher Deals,10+ Best Dishwasher Deals - Bob Vila,10+ Best Dishwasher Deals - Bob Vila,,
https://www.bobvila.com/articles/best-hand-saw/,"The Best Hand Saws, Tested","The Best Hand Saws, Tested - Top Picks from Bob Vila","The Best Hand Saws, Tested - Top Picks from Bob Vila",,
https://www.bobvila.com/articles/best-hand-tools/,"The Best Hand Tools, Tested and Reviewed","The Best Hand Tools, Tested & Reviewed %%sep%% Top Picks from %%sitename%%","The Best Hand Tools, Tested & Reviewed %%sep%% Top Picks from %%sitename%%",,
https://www.bobvila.com/articles/best-garage-air-conditioners/,The Best Garage Air Conditioners,The Best Garage Air Conditioners %%sep%% Picks by %%sitename%%,The Best Garage Air Conditioners %%sep%% Picks by %%sitename%%,,
https://www.bobvila.com/articles/best-water-heater-brands/,,The Best Water Heater Brands - Picks from Bob Vila,The Best Water Heater Brands - Picks from Bob Vila,"We found the best water heater brands. See what makes water heaters from Bosch, Ecosmart, Rheem, Rinnai, and more the top options for your home.","We found the best water heater brands. See what makes water heaters from Bosch, Ecosmart, Rheem, Rinnai, and more the top options for your home."
