id,post_title,seo_title,meta__yoast_wpseo_title,seo_description,meta__yoast_wpseo_metadesc
https://www.bobvila.com/articles/best-cordless-phone/,The Best Cordless Phones,The Best Cordless Phones - Top Picks by Bob Vila,The Best Cordless Phones - Top Picks by Bob Vila,,
https://www.bobvila.com/articles/best-steam-mop/,"The Best Steam Mops, Tested","The Best Steam Mops, Tested - Top Picks from Bob Vila","The Best Steam Mops, Tested - Top Picks from Bob Vila",,
https://www.bobvila.com/articles/best-mini-fridge/,The Best Mini Fridges,The Best Mini Fridge Options- Top Picks by Bob Vila,The Best Mini Fridge Options- Top Picks by Bob Vila,,
https://www.bobvila.com/articles/best-shower-head-for-low-water-pressure/,The Best Shower Heads for Low Water Pressure,The Best Shower Heads for Low Water Pressure - Top Picks by Bob Vila,The Best Shower Heads for Low Water Pressure - Top Picks by Bob Vila,,
https://www.bobvila.com/articles/best-foreclosure-sites/,The Best Foreclosure Sites,The Best Foreclosure Sites - Picks by Bob Vila,The Best Foreclosure Sites - Picks by Bob Vila,,
https://www.bobvila.com/articles/best-portable-closet/,"The Best Portable Closets, Reviewed","The Best Portable Closets, Reviewed %%sep%% Picks by %%sitename%%","The Best Portable Closets, Reviewed %%sep%% Picks by %%sitename%%",,
https://www.bobvila.com/articles/best-storage-bins/,"The Best Storage Bins, Tested and Reviewed","The Best Storage Bins, Tested & Reviewed %%sep%% Picks by %%sitename%%","The Best Storage Bins, Tested & Reviewed %%sep%% Picks by %%sitename%%",,
https://www.bobvila.com/articles/best-vacuum-sealers/,"The Best Vacuum Sealers, Vetted","The Best Vacuum Sealers, Vetted - Tested by Bob Vila","The Best Vacuum Sealers, Vetted - Tested by Bob Vila",,
https://www.bobvila.com/articles/best-condo-insurance-california/,The Best Condo Insurance in California,The Best Condo Insurance in California - Picks by Bob Vila,The Best Condo Insurance in California - Picks by Bob Vila,,
https://www.bobvila.com/articles/best-cheap-fire-pits/,,The Best Cheap Fire Pits Worth the Money - Bob Vila,The Best Cheap Fire Pits Worth the Money - Bob Vila,,
https://www.bobvila.com/articles/best-airbnbs-in-myrtle-beach/,The 15 Best Airbnbs in Myrtle Beach,The 15 Best Airbnbs in Myrtle Beach - Picks by Bob Vila,The 15 Best Airbnbs in Myrtle Beach - Picks by Bob Vila,,
https://www.bobvila.com/articles/best-airbnb-california/,The 20 Best Airbnbs in California,The 20 Best Airbnbs in California - Picks by Bob Vila,The 20 Best Airbnbs in California - Picks by Bob Vila,,
https://www.bobvila.com/articles/best-airbnbs-in-orlando-near-disney/,The 12 Best Airbnbs in Orlando Near Disney World,The 12 Best Airbnbs in Orlando Near Disney World - Picks by Bob Vila,The 12 Best Airbnbs in Orlando Near Disney World - Picks by Bob Vila,,
https://www.bobvila.com/articles/best-fire-damage-restoration-services/,The Best Fire Damage Restoration Services,The Best Fire Damage Restoration Services - Picks by Bob Vila,The Best Fire Damage Restoration Services - Picks by Bob Vila,,
https://www.bobvila.com/articles/best-organic-lawn-fertilizer/,"The Best Organic Lawn Fertilizers, Vetted","The Best Organic Lawn Fertilizers, Vetted %%sep%% Picks by %%sitename%%","The Best Organic Lawn Fertilizers, Vetted %%sep%% Picks by %%sitename%%",,
https://www.bobvila.com/articles/best-chipper-shredder/,The Best Chipper Shredders You Can Get,The Best Chipper Shredders You Can Get %%sep%% Picks by %%sitename%%,The Best Chipper Shredders You Can Get %%sep%% Picks by %%sitename%%,,
https://www.bobvila.com/articles/best-weed-killer/,The Best Weed Killers,"The 6 Best Weed Killers, from Our Hands-On Tests - Bob Vila","The 6 Best Weed Killers, from Our Hands-On Tests - Bob Vila",,
https://www.bobvila.com/articles/best-weed-killers-for-gravel/,The Best Weed Killers for Gravel,The Best Weed Killers for Gravel - Bob Vila,The Best Weed Killers for Gravel - Bob Vila,,
https://www.bobvila.com/articles/best-grub-killer/,The Best Grub Killers,The Best Grub Killers You Can Get - Reviews by Bob Vila,The Best Grub Killers You Can Get - Reviews by Bob Vila,,
https://www.bobvila.com/articles/best-weed-killers-for-bermuda-grass/,The Best Weed Killers for Bermuda Grass,The Best Weed Killers for Bermuda Grass %%sep%% Picks from %%sitename%%,The Best Weed Killers for Bermuda Grass %%sep%% Picks from %%sitename%%,,
https://www.bobvila.com/articles/best-scorpion-killer/,"The Best Scorpion Killers, Vetted","The Best Scorpion Killers, Vetted %%sep%% Picks by %%sitename%%","The Best Scorpion Killers, Vetted %%sep%% Picks by %%sitename%%",,
https://www.bobvila.com/articles/best-fire-ant-killer/,"The Best Fire Ant Killers, Vetted","The Best Fire Ant Killers, Vetted - Picks from Bob Vila","The Best Fire Ant Killers, Vetted - Picks from Bob Vila",,
https://www.bobvila.com/articles/best-brush-killer/,"The Best Brush Killers, Vetted","The Best Brush Killers, Vetted - Picks from %%sitename%%","The Best Brush Killers, Vetted - Picks from %%sitename%%",,
https://www.bobvila.com/articles/best-seedling-heat-mats/,The Best Seedling Heat Mats,The Best Seedling Heat Mats - Top Picks from Bob Vila,The Best Seedling Heat Mats - Top Picks from Bob Vila,,
https://www.bobvila.com/articles/best-memorial-tree-planting-services/,The Best Memorial Tree-Planting Services in America,The Best Memorial Tree-Planting Services in America - Picks by Bob Vila,The Best Memorial Tree-Planting Services in America - Picks by Bob Vila,,
https://www.bobvila.com/articles/best-mop/,The Best Mops You Can Get,The Best Mops You Can Get - Recommendations from %%sitename%%,The Best Mops You Can Get - Recommendations from %%sitename%%,,
https://www.bobvila.com/articles/best-mop-for-laminate-floors/,The Best Mops for Laminate Floors,The Best Mop for Laminate Floors of 2024 - Bob Vila,The Best Mop for Laminate Floors of 2024 - Bob Vila,,
https://www.bobvila.com/articles/best-online-interior-design-courses/,The Best Online Interior Design Courses of 2024,The Best Online Interior Design Courses of 2024 - Bob Vila,The Best Online Interior Design Courses of 2024 - Bob Vila,,
https://www.bobvila.com/articles/best-seed-starting-mix/,The Best Seed Starting Mixes,The Best Seed Starting Mixes %%sep%% Picks from %%sitename%%,The Best Seed Starting Mixes %%sep%% Picks from %%sitename%%,,
https://www.bobvila.com/articles/where-to-go-trick-or-treating/,,Where to Go Trick-or-Treating: The 24 Best U.S. Cities - Bob Vila,Where to Go Trick-or-Treating: The 24 Best U.S. Cities - Bob Vila,,
https://www.bobvila.com/articles/housewarming-gifts/,,24 Best Housewarming Gifts - Elegant Housewarming Gift Ideas from Bob Vila,24 Best Housewarming Gifts - Elegant Housewarming Gift Ideas from Bob Vila,,
https://www.bobvila.com/articles/best-wall-tapestries/,The Best Wall Tapestries,The Best Wall Tapestries - Bob Vila,The Best Wall Tapestries - Bob Vila,,
https://www.bobvila.com/articles/best-heated-socks/,The Best Heated Socks of 2024,The Best Heated Socks of 2024 - Reviewed by Bob Vila,The Best Heated Socks of 2024 - Reviewed by Bob Vila,,
https://www.bobvila.com/articles/best-level/,The Best Levels,The Best Levels - Bob Vila,The Best Levels - Bob Vila,,
https://www.bobvila.com/articles/best-home-warranty-for-septic-systems/,The Best Home Warranties for Septic Systems,The Best Home Warranties for Septic Systems - Picks by Bob Vila,The Best Home Warranties for Septic Systems - Picks by Bob Vila,,
https://www.bobvila.com/articles/best-cordless-finish-nailer/,The Best Cordless Finish Nailers of 2024,The Best Cordless Finish Nailer Options of 2024 - Top Picks by Bob Vila,The Best Cordless Finish Nailer Options of 2024 - Top Picks by Bob Vila,,
https://www.bobvila.com/articles/best-cordless-brad-nailer/,"The Best Cordless Brad Nailers, Tested","The Best Cordless Brad Nailers, Tested - Top Picks by Bob Vila","The Best Cordless Brad Nailers, Tested - Top Picks by Bob Vila",,
https://www.bobvila.com/articles/best-bird-bath/,"The Best Bird Baths, Tested and Reviewed","The Best Bird Baths, Tested & Reviewed by %%sitename%%","The Best Bird Baths, Tested & Reviewed by %%sitename%%",,
https://www.bobvila.com/articles/best-water-filter/,"The Best Water Filters, Reviewed","The Best Water Filters, Reviewed - Top Picks by Bob Vila","The Best Water Filters, Reviewed - Top Picks by Bob Vila",,
https://www.bobvila.com/articles/best-alkaline-water-filter-pitcher/,The Best Alkaline Water Filter Pitchers,The Best Alkaline Water Filter Pitchers - Picks by Bob Vila,The Best Alkaline Water Filter Pitchers - Picks by Bob Vila,,
https://www.bobvila.com/articles/best-home-warranty-for-older-homes/,The Best Home Warranties for Older Homes,The Best Home Warranties for Older Homes - Picks by Bob Vila,The Best Home Warranties for Older Homes - Picks by Bob Vila,,
https://www.bobvila.com/articles/best-home-warranty-for-pre-existing-conditions/,The Best Home Warranties for Pre-Existing Conditions,The Best Home Warranties for Pre-Existing Conditions - Picks by Bob Vila,The Best Home Warranties for Pre-Existing Conditions - Picks by Bob Vila,,
https://www.bobvila.com/articles/best-home-warranty-companies-new-jersey/,The Best Home Warranty Companies in New Jersey,The Best Home Warranty Companies in New Jersey - Picks by Bob Vila,The Best Home Warranty Companies in New Jersey - Picks by Bob Vila,,
https://www.bobvila.com/articles/best-home-warranty-companies-in-ohio/,The Best Home Warranty Companies in Ohio,The Best Home Warranty Companies in Ohio - Picks by Bob Vila,The Best Home Warranty Companies in Ohio - Picks by Bob Vila,,
https://www.bobvila.com/articles/best-home-warranty-companies-houston/,The Best Home Warranty Companies in Houston,The Best Home Warranty Companies in Houston - Picks by Bob Vila,The Best Home Warranty Companies in Houston - Picks by Bob Vila,,
https://www.bobvila.com/articles/best-home-warranty-companies-in-maryland/,The Best Home Warranty Companies in Maryland,The Best Home Warranty Companies in Maryland - Picks by Bob Vila,The Best Home Warranty Companies in Maryland - Picks by Bob Vila,,
https://www.bobvila.com/articles/best-home-warranty-companies-in-dallas/,The Best Home Warranty Companies in Dallas,The Best Home Warranty Companies in Dallas - Picks by Bob Vila,The Best Home Warranty Companies in Dallas - Picks by Bob Vila,,
https://www.bobvila.com/articles/best-home-warranty-companies-in-virginia/,The Best Home Warranty Companies in Virginia,The Best Home Warranty Companies in Virginia - Picks by Bob Vila,The Best Home Warranty Companies in Virginia - Picks by Bob Vila,,
https://www.bobvila.com/articles/best-french-fry-cutter/,,The 9 Best French Fry Cutters for Slicing Potatoes ,The 9 Best French Fry Cutters for Slicing Potatoes ,,
https://www.bobvila.com/articles/best-fire-logs/,,Enjoy Long-Lasting Ambience With the Best Tested Fire Logs,Enjoy Long-Lasting Ambience With the Best Tested Fire Logs,,
https://www.bobvila.com/articles/best-infrared-heater/,The 10 Best Infrared Heaters of 2024 From Our Hands-On Tests,"The 10 Best Infrared Heaters of 2024, From Our Hands-On Tests","The 10 Best Infrared Heaters of 2024, From Our Hands-On Tests",,
https://www.bobvila.com/articles/best-sauna-heaters/,,Get a Great Home Spa Experience With the Best Sauna Heaters,Get a Great Home Spa Experience With the Best Sauna Heaters,,
https://www.bobvila.com/articles/best-exterior-caulk/,Testing the 9 Best Exterior Caulks,"The 9 Best Exterior Caulks, Tested and Reviewed","The 9 Best Exterior Caulks, Tested and Reviewed",,
https://www.bobvila.com/articles/best-voltage-tester/,,"The 8 Best Voltage Testers, According to Experts","The 8 Best Voltage Testers, According to Experts",,
https://www.bobvila.com/articles/best-rechargeable-battery-charges/,,"The Best Rechargeable Battery Chargers, Reviewed by Bob Vila","The Best Rechargeable Battery Chargers, Reviewed by Bob Vila",,
https://www.bobvila.com/articles/best-skylights/,The Best Skylights of 2024,The Best Skylights of 2024 %%sep%% Picks from %%sitename%%,The Best Skylights of 2024 %%sep%% Picks from %%sitename%%,,
https://www.bobvila.com/articles/best-flea-fogger/,,The 5 Best Flea Foggers - Top Picks by Bob Vila,The 5 Best Flea Foggers - Top Picks by Bob Vila,,
https://www.bobvila.com/articles/best-ge-dishwashers/,The Best GE Dishwashers You Can Get,The Best GE Dishwashers You Can Get %%sep%% Picks from %%sitename%%,The Best GE Dishwashers You Can Get %%sep%% Picks from %%sitename%%,,
https://www.bobvila.com/articles/best-leaf-vacuum/,"The Best Leaf Vacuums, Tested and Reviewed",The Best Leaf Vacuums of 2024 %%sep%% Tested by %%sitename%%,The Best Leaf Vacuums of 2024 %%sep%% Tested by %%sitename%%,,
https://www.bobvila.com/articles/best-electric-leaf-blower/,,The 10 Best Electric Leaf Blowers - Reviewed by Bob Vila,The 10 Best Electric Leaf Blowers - Reviewed by Bob Vila,,
https://www.bobvila.com/articles/best-cordless-blower/,The Best Cordless Blowers of 2024,The Best Cordless Blower Models of 2024 - Bob Vila,The Best Cordless Blower Models of 2024 - Bob Vila,,
https://www.bobvila.com/articles/best-string-trimmer/,"The Best String Trimmers, Tested",The Best String Trimmers - Tested by Bob Vila,The Best String Trimmers - Tested by Bob Vila,,
https://www.bobvila.com/articles/best-leaf-mulcher/,"The Best Leaf Mulchers, Tested and Reviewed",The Best Leaf Mulchers Tested in 2024 - Bob Vila,The Best Leaf Mulchers Tested in 2024 - Bob Vila,,
https://www.bobvila.com/articles/lowes-labor-day-deals/,,The Best Labor Day Deals to Shop at Lowe's - Bob Vila,The Best Labor Day Deals to Shop at Lowe's - Bob Vila,,
https://www.bobvila.com/articles/best-fan-for-white-noise/,The Best Fans for White Noise,The Best Fans for White Noise %%sep%% Picks by %%sitename%%,The Best Fans for White Noise %%sep%% Picks by %%sitename%%,,
https://www.bobvila.com/articles/best-power-scrubber/,"The Best Power Scrubbers, Tested",The Best Power Scrubbers - Tested by Bob Vila,The Best Power Scrubbers - Tested by Bob Vila,,
https://www.bobvila.com/articles/best-bathroom-remodeling-companies/,The Best Bathroom Remodeling Companies in America,The Best Bathroom Remodeling Companies in America - Picks by Bob Vila,The Best Bathroom Remodeling Companies in America - Picks by Bob Vila,,
https://www.bobvila.com/articles/best-planters-for-small-balconies/,The 10 Best Planters for Small Balconies,The 10 Best Planters for Small Balconies - Bob Vila,The 10 Best Planters for Small Balconies - Bob Vila,,
https://www.bobvila.com/articles/best-single-serve-coffee-makers/,The Best Single-Serve Coffee Makers,The Best Single-Serve Coffee Makers %%sep%% Picks by %%sitename%%,The Best Single-Serve Coffee Makers %%sep%% Picks by %%sitename%%,,
https://www.bobvila.com/articles/best-gravity-water-filter/,"The Best Gravity Water Filters, Vetted","The Best Gravity Water Filters, Vetted %%sep%% Picks by %%sitename%%","The Best Gravity Water Filters, Vetted %%sep%% Picks by %%sitename%%",,
https://www.bobvila.com/articles/best-garage-door-christmas-decorations/,The 16 Best Garage Door Christmas Decorations,The 16 Best Garage Door Christmas Decorations - Bob Vila,The 16 Best Garage Door Christmas Decorations - Bob Vila,,
https://www.bobvila.com/articles/best-front-door-wreaths/,,The 11 Best Front Door Wreaths - Bob Vila,The 11 Best Front Door Wreaths - Bob Vila,,
https://www.bobvila.com/articles/best-garage-doors/,The 10 Best Garage Doors,The 10 Best Garage Doors - Bob Vila,The 10 Best Garage Doors - Bob Vila,,
https://www.bobvila.com/articles/best-console-tables/,The Best Console Tables,The Best Console Tables - Bob Vila,The Best Console Tables - Bob Vila,"We found the best console tables to complement your home. Shop our top picks from Target, Wayfair, Amazon, and more.","We found the best console tables to complement your home. Shop our top picks from Target, Wayfair, Amazon, and more."
https://www.bobvila.com/articles/best-vacuum-under-200/,The Best Vacuums Under $200,The Best Vacuums Under $200 %%sep%% Picks from %%sitename%%,The Best Vacuums Under $200 %%sep%% Picks from %%sitename%%,,
https://www.bobvila.com/articles/best-vacuums-for-laminate-floors/,,The Best Vacuums for Laminate Floors - Bob Vila,The Best Vacuums for Laminate Floors - Bob Vila,,
https://www.bobvila.com/articles/buyers-guide-best-step-ladder/,"The Best Step Ladders, Tested",The Best Step Ladders - Tested by Bob Vila,The Best Step Ladders - Tested by Bob Vila,,
https://www.bobvila.com/articles/best-led-shop-lights/,The Best LED Shop Lights of 2024,The Best LED Shop Lights of 2024 %%sep%% Picks by %%sitename%%,The Best LED Shop Lights of 2024 %%sep%% Picks by %%sitename%%,,
https://www.bobvila.com/articles/best-countertop-dishwashers/,The Best Countertop Dishwashers Today,The Best Countertop Dishwashers Today %%sep%% Picks from %%sitename%%,The Best Countertop Dishwashers Today %%sep%% Picks from %%sitename%%,,
https://www.bobvila.com/articles/best-home-builders-in-florida/,The Best Home Builders in Florida,The Best Home Builders in Florida - Picks by Bob Vila,The Best Home Builders in Florida - Picks by Bob Vila,,
https://www.bobvila.com/articles/best-grill-thermometer/,"The Best Grill Thermometers, Tested and Reviewed",%%title%% %%sep%% Tested by %%sitename%%,%%title%% %%sep%% Tested by %%sitename%%,,
https://www.bobvila.com/articles/best-dog-gates/,The Best Dog Gates,The Best Dog Gates - Picks from Bob Vila,The Best Dog Gates - Picks from Bob Vila,,
https://www.bobvila.com/articles/best-rv-sewer-hoses/,The Best RV Sewer Hoses,The Best RV Sewer Hoses %%sep%% Picks from %%sitename%%,The Best RV Sewer Hoses %%sep%% Picks from %%sitename%%,,
https://www.bobvila.com/articles/best-gardening-hats/,The Best Gardening Hats,The Best Gardening Hats %%sep%% Picks by %%sitename%%,The Best Gardening Hats %%sep%% Picks by %%sitename%%,,
https://www.bobvila.com/articles/best-gardening-aprons/,The Best Gardening Aprons,The Best Gardening Aprons %%sep%% Picks by %%sitename%%,The Best Gardening Aprons %%sep%% Picks by %%sitename%%,,
https://www.bobvila.com/articles/best-moon-lamp/,,The Best Moon Lamp for Relaxing - Bob Vila,The Best Moon Lamp for Relaxing - Bob Vila,,
https://www.bobvila.com/articles/best-turkey-fryer/,"The Best Turkey Fryers, Tested and Reviewed","The Best Turkey Fryer, Tested & Reviewed (2024) - Tested by Bob Vila","The Best Turkey Fryer, Tested & Reviewed (2024) - Tested by Bob Vila",,
https://www.bobvila.com/articles/best-potting-soil/,The Best Potting Soil Mixes,The Best Potting Soil Mixes - Top Picks from Bob Vila,The Best Potting Soil Mixes - Top Picks from Bob Vila,,
https://www.bobvila.com/articles/best-indoor-christmas-lights/,The 11 Best Indoor Christmas Lights,The 11 Best Indoor Christmas Lights - Recommended by Bob Vila,The 11 Best Indoor Christmas Lights - Recommended by Bob Vila,,
https://www.bobvila.com/articles/best-countertop-compost-bin/,"The Best Countertop Compost Bins, Vetted","The Best Countertop Compost Bins, Vetted - Bob Vila","The Best Countertop Compost Bins, Vetted - Bob Vila",,
https://www.bobvila.com/articles/best-leather-repair-kit/,The Best Leather Repair Kits,The Best Leather Repair Kits - Top Picks by Bob Vila,The Best Leather Repair Kits - Top Picks by Bob Vila,,
https://www.bobvila.com/articles/best-rolling-tool-box/,The Best Rolling Tool Boxes,"The Best Rolling Tool Boxes, Vetted - Top Picks by Bob Vila","The Best Rolling Tool Boxes, Vetted - Top Picks by Bob Vila",,
https://www.bobvila.com/articles/best-super-glue/,"The Best Super Glues, Tested",The Best Super Glues - Tested by Bob Vila,The Best Super Glues - Tested by Bob Vila,,
https://www.bobvila.com/articles/best-fly-trap/,"The Best Fly Traps, Vetted",The Best Fly Traps - Recommended by Bob Vila,The Best Fly Traps - Recommended by Bob Vila,,
https://www.bobvila.com/articles/best-drill-bits-for-tile/,"The Best Drill Bits for Tile, Tested and Reviewed",The Best Drill Bits for Tile %%sep%% Tested by %%sitename%%,The Best Drill Bits for Tile %%sep%% Tested by %%sitename%%,,
https://www.bobvila.com/articles/best-lawn-mower-repair-services/,The Best Lawn Mower Repair Services in America,The Best Lawn Mower Repair Services in America - Picks By Bob Vila,The Best Lawn Mower Repair Services in America - Picks By Bob Vila,,
https://www.bobvila.com/articles/best-pants-hanger/,,The Best Pants Hangers for Your Closet - Bob Vila,The Best Pants Hangers for Your Closet - Bob Vila,,
https://www.bobvila.com/articles/best-bow-saw/,,The Best Bow Saws for Fast Cuts - Bob Vila,The Best Bow Saws for Fast Cuts - Bob Vila,,
https://www.bobvila.com/articles/best-satin-sheets/,,The Best Satin Sheets for the Bedroom - Bob Vila,The Best Satin Sheets for the Bedroom - Bob Vila,,
https://www.bobvila.com/articles/best-standby-generator/,The Best Standby Generators,The Best Standby Generators - Top Picks by Bob Vila,The Best Standby Generators - Top Picks by Bob Vila,,
https://www.bobvila.com/articles/generator-cover/,"The Best Generator Covers, Vetted","The Best Generator Covers, Vetted - Bob Vila","The Best Generator Covers, Vetted - Bob Vila",,
https://www.bobvila.com/articles/best-cheap-home-generators/,The Best Cheap Home Generators of 2024,The Best Cheap Home Generators of 2024 %%sep%% Picks by %%sitename%%,The Best Cheap Home Generators of 2024 %%sep%% Picks by %%sitename%%,,
https://www.bobvila.com/articles/best-mouse-poison/,"The Best Mouse Poisons, Vetted","The Best Mouse Poisons, Vetted - Top Picks by Bob Vila","The Best Mouse Poisons, Vetted - Top Picks by Bob Vila",,
https://www.bobvila.com/articles/best-space-heater/,,"The Best Space Heaters, Tested - Picks by Bob Vila","The Best Space Heaters, Tested - Picks by Bob Vila",,
https://www.bobvila.com/articles/best-floor-fan/,"The Best Floor Fans, Tested","The Best Floor Fans, According to Testing - Bob Vila","The Best Floor Fans, According to Testing - Bob Vila",,
https://www.bobvila.com/articles/best-garage-fan/,"The Best Garage Fans, Vetted","The Best Garage Fans, Vetted - Picks by Bob Vila","The Best Garage Fans, Vetted - Picks by Bob Vila",,
https://www.bobvila.com/articles/best-fans/,The Best Fans You Can Get,The Best Fans You Can Get %%sep%% Picks from %%sitename%%,The Best Fans You Can Get %%sep%% Picks from %%sitename%%,,
https://www.bobvila.com/articles/best-kitchen-remodeling-companies/,The Best Kitchen Remodeling Companies in America,The Best Kitchen Remodeling Companies in America - Picks by Bob Vila,The Best Kitchen Remodeling Companies in America - Picks by Bob Vila,,
https://www.bobvila.com/articles/best-grilling-accessories/,The 13 Best Grilling Accessories You Can Get,The 13 Best Grilling Accessories You Can Get - Bob Vila,The 13 Best Grilling Accessories You Can Get - Bob Vila,,
https://www.bobvila.com/articles/best-bathroom-faucet/,The Best Bathroom Faucets,The Best Bathroom Faucets - Top Picks from Bob Vila,The Best Bathroom Faucets - Top Picks from Bob Vila,,
https://www.bobvila.com/articles/best-driveway-paving-companies/,The Best Driveway Paving Companies in America,The Best Driveway Paving Companies in America - Picks by Bob Vila,The Best Driveway Paving Companies in America - Picks by Bob Vila,,
https://www.bobvila.com/articles/best-ozone-generator/,The Best Ozone Generators,The Best Ozone Generators - Top Picks by Bob Vila,The Best Ozone Generators - Top Picks by Bob Vila,,
https://www.bobvila.com/articles/best-tree-planting-services/,The Best Tree-Planting Services in America,The Best Tree-Planting Services in America - Picks by Bob Vila,The Best Tree-Planting Services in America - Picks by Bob Vila,,
https://www.bobvila.com/articles/best-home-warranty-oklahoma/,The Best Home Warranty Companies in Oklahoma,The Best Home Warranty Companies in Oklahoma - Picks by Bob Vila,The Best Home Warranty Companies in Oklahoma - Picks by Bob Vila,,
https://www.bobvila.com/articles/best-home-warranty-louisiana/,The Best Home Warranty Companies in Louisiana,The Best Home Warranty Companies in Louisiana - Picks by Bob Vila,The Best Home Warranty Companies in Louisiana - Picks by Bob Vila,,
https://www.bobvila.com/articles/best-home-warranty-companies-georgia/,The Best Home Warranty Companies in Georgia,The Best Home Warranty Companies in Georgia - Picks by Bob Vila,The Best Home Warranty Companies in Georgia - Picks by Bob Vila,,
https://www.bobvila.com/articles/best-home-warranty-company-illinois/,The Best Home Warranty Companies in Illinois,The Best Home Warranty Companies in Illinois - Picks by Bob Vila,The Best Home Warranty Companies in Illinois - Picks by Bob Vila,,
https://www.bobvila.com/articles/best-flood-insurance-companies/,The Best Flood Insurance Companies,The Best Flood Insurance Companies - Bob Vila,The Best Flood Insurance Companies - Bob Vila,,
https://www.bobvila.com/articles/best-gutter-cleaning-services/,,The Best Gutter Cleaning Services of 2024,The Best Gutter Cleaning Services of 2024,,
https://www.bobvila.com/articles/best-mattresses-for-back-pain/,The Best Mattresses for Back Pain,The Best Mattresses for Back Pain (2024) - Bob Vila,The Best Mattresses for Back Pain (2024) - Bob Vila,,
https://www.bobvila.com/articles/best-mattress-in-a-box/,The Best Mattresses in a Box,The Best Mattresses in a Box - Top Picks by Bob Vila,The Best Mattresses in a Box - Top Picks by Bob Vila,,
https://www.bobvila.com/articles/best-sofa-bed-mattress/,The Best Sofa Bed Mattresses,The Best Sofa Bed Mattresses - Top Picks from Bob Vila,The Best Sofa Bed Mattresses - Top Picks from Bob Vila,,
https://www.bobvila.com/articles/best-disinfectant-sprays/,The Best Disinfectant Sprays of Today,The Best Disinfectant Sprays of Today %%sep%% Picks by %%sitename%%,The Best Disinfectant Sprays of Today %%sep%% Picks by %%sitename%%,,
https://www.bobvila.com/articles/best-axe-for-splitting-wood/,"The Best Axes, Tested","The Best Axes, Tested - Picks by Bob Vila","The Best Axes, Tested - Picks by Bob Vila",,
