id,post_title,seo_title,meta__yoast_wpseo_title,seo_description,meta__yoast_wpseo_metadesc
https://www.bobvila.com/articles/best-freezer/,The Best Freezers You Can Get,The Best Freezers You Can Get - Top Picks by Bob Vila,The Best Freezers You Can Get - Top Picks by Bob Vila,,
https://www.bobvila.com/articles/best-bread-boxes/,9 Best Bread Boxes,9 Best Bread Boxes - Reviewed by Bob Vila,9 Best Bread Boxes - Reviewed by Bob Vila,,
https://www.bobvila.com/articles/best-soundproofing-material/,The Best Soundproofing Materials,The Best Soundproofing Materials - Top Picks by Bob Vila,The Best Soundproofing Materials - Top Picks by Bob Vila,,
https://www.bobvila.com/articles/best-ironing-board/,,The Best Ironing Boards - Reviewed by Bob Vila,The Best Ironing Boards - Reviewed by Bob Vila,,
https://www.bobvila.com/articles/best-smart-switch/,,The 9 Best Smart Switches - Reviewed and Recommended by Bob Vila,The 9 Best Smart Switches - Reviewed and Recommended by Bob Vila,,
https://www.bobvila.com/articles/best-meat-thermometers/,,The Best Meat Thermometers - Tested & Reviewed by Bob Vila,The Best Meat Thermometers - Tested & Reviewed by Bob Vila,,
https://www.bobvila.com/articles/best-central-vacuum-system/,,The Best Central Vacuum System for a Whole-House Clean - Bob Vila,The Best Central Vacuum System for a Whole-House Clean - Bob Vila,,
https://www.bobvila.com/articles/best-rain-shower-head/,,"The 9 Best Rain Shower Heads, Tested - Reviewed by Bob Vila","The 9 Best Rain Shower Heads, Tested - Reviewed by Bob Vila",,
https://www.bobvila.com/articles/best-chimney-cleaning-services/,The Best Chimney Cleaning Services,The Best Chimney Cleaning Services,The Best Chimney Cleaning Services,,
https://www.bobvila.com/articles/best-sharpening-stone/,,"The Best Sharpening Stones, Tested - Reviewed by Bob Vila","The Best Sharpening Stones, Tested - Reviewed by Bob Vila",,
https://www.bobvila.com/articles/best-ceramic-heater/,,The 10 Best Ceramic Heaters - Reviewed by Bob Vila,The 10 Best Ceramic Heaters - Reviewed by Bob Vila,,
https://www.bobvila.com/articles/best-dish-soap-dispenser/,,The 10 Best Dish Soap Dispensers - Reviewed by Bob Vila,The 10 Best Dish Soap Dispensers - Reviewed by Bob Vila,,
https://www.bobvila.com/articles/best-place-to-buy-outdoor-plants-online/,,The 12 Best Places to Buy Outdoor Plants Online - Bob Vila,The 12 Best Places to Buy Outdoor Plants Online - Bob Vila,,
https://www.bobvila.com/articles/best-rooting-hormone/,The Best Rooting Hormones,The Best Rooting Hormone Options Today - Top Picks by Bob Vila,The Best Rooting Hormone Options Today - Top Picks by Bob Vila,,
https://www.bobvila.com/articles/best-wasp-traps/,"The Best Wasp Traps, Reviewed","The Best Wasp Traps, Reviewed %%sep%% Picks from %%sitename%%","The Best Wasp Traps, Reviewed %%sep%% Picks from %%sitename%%",,
https://www.bobvila.com/articles/best-fertilizer-for-hibiscus/,,The Best Fertilizers for Hibiscus Plants - Bob Vila,The Best Fertilizers for Hibiscus Plants - Bob Vila,,
https://www.bobvila.com/articles/best-fertilizers-for-hydrangeas/,,The 6 Best Fertilizers for Hydrangeas  - Bob Vila,The 6 Best Fertilizers for Hydrangeas  - Bob Vila,,
https://www.bobvila.com/articles/best-pre-emergent-herbicide/,"The Best Pre-Emergent Herbicides, Vetted",The Best Pre-Emergent Herbicides - Top Picks by Bob Vila,The Best Pre-Emergent Herbicides - Top Picks by Bob Vila,,
https://www.bobvila.com/articles/best-soil-for-tomatoes/,The Best Soil for Tomatoes,The Best Soil for Tomatoes - Top Picks by Bob Vila,The Best Soil for Tomatoes - Top Picks by Bob Vila,,
https://www.bobvila.com/articles/best-garden-cart/,"The Best Garden Carts, Tested",The Best Garden Carts - Tested by Bob Vila,The Best Garden Carts - Tested by Bob Vila,,
https://www.bobvila.com/articles/best-carpenter-bee-trap/,"The Best Carpenter Bee Traps, Vetted","The Best Carpenter Bee Traps, Vetted - Recommendations from Bob Vila","The Best Carpenter Bee Traps, Vetted - Recommendations from Bob Vila",,
https://www.bobvila.com/articles/best-soil-for-succulents/,The Best Soils for Succulents,The Best Soils for Succulents - Picks from %%sitename%%,The Best Soils for Succulents - Picks from %%sitename%%,,
https://www.bobvila.com/articles/best-garden-fertilizer/,"The Best Garden Fertilizers, Vetted","The Best Garden Fertilizers, Vetted - Picks from %%sitename%%","The Best Garden Fertilizers, Vetted - Picks from %%sitename%%",,
https://www.bobvila.com/articles/best-soil-for-blueberries/,The Best Soil for Blueberries,The Best Soil for Blueberries - Top Picks from Bob Vila,The Best Soil for Blueberries - Top Picks from Bob Vila,,
https://www.bobvila.com/articles/best-soil-for-strawberries/,The Best Soil for Strawberries,The Best Soil for Strawberries - Top Picks by Bob Vila,The Best Soil for Strawberries - Top Picks by Bob Vila,,
https://www.bobvila.com/articles/best-organic-fertilizer/,"The Best Organic Fertilizers, Vetted","The Best Organic Fertilizers, Vetted - Picks from Bob Vila","The Best Organic Fertilizers, Vetted - Picks from Bob Vila",,
https://www.bobvila.com/articles/best-gifts-for-pool-owners/,The 18 Best Gifts for Pool Owners – Editor Approved,The 18 Best Gifts for Pool Owners - Editor Approved - Bob Vila,The 18 Best Gifts for Pool Owners - Editor Approved - Bob Vila,,
https://www.bobvila.com/articles/best-spin-mops/,"The Best Spin Mops, Tested and Reviewed","The Best Spin Mops, Tested & Reviewed - Top Picks by Bob Vila","The Best Spin Mops, Tested & Reviewed - Top Picks by Bob Vila",,
https://www.bobvila.com/articles/best-propane-tankless-water-heater/,The Best Propane Tankless Water Heaters of 2024,The Best Propane Tankless Water Heaters of 2024 %%sep%% Picks from %%sitename%%,The Best Propane Tankless Water Heaters of 2024 %%sep%% Picks from %%sitename%%,,
https://www.bobvila.com/articles/best-outdoor-saunas/,The Best Outdoor Saunas of Today,The Best Outdoor Saunas of Today %%sep%% Picks from %%sitename%%,The Best Outdoor Saunas of Today %%sep%% Picks from %%sitename%%,,
https://www.bobvila.com/articles/best-garage-door-threshold/,The Best Garage Door Thresholds,The Best Garage Door Thresholds - Picks from Bob Vila,The Best Garage Door Thresholds - Picks from Bob Vila,,
https://www.bobvila.com/articles/best-garage-floor-paint/,"The Best Garage Floor Paints, Vetted","The Best Garage Floor Paints, Vetted - Top Picks by Bob Vila","The Best Garage Floor Paints, Vetted - Top Picks by Bob Vila",,
https://www.bobvila.com/articles/best-grills/,"The Best Grills, Tested and Reviewed","The Best Grills, Tested & Reviewed - Top Picks from %%sitename%%","The Best Grills, Tested & Reviewed - Top Picks from %%sitename%%",,
https://www.bobvila.com/articles/best-grill-brands/,The 13 Best Grill Brands,The 13 Best Grill Brands,The 13 Best Grill Brands,,
https://www.bobvila.com/articles/best-pendant-lights/,The Best Pendant Lights,The Best Pendant Lights - Top Picks by Bob Vila,The Best Pendant Lights - Top Picks by Bob Vila,,
https://www.bobvila.com/articles/best-chandeliers/,The Best Chandeliers,The Best Chandeliers - Picks from Bob Vila,The Best Chandeliers - Picks from Bob Vila,,
https://www.bobvila.com/articles/cordless-lamp/,The Best Cordless Lamps You Can Get,The Best Cordless Lamps You Can Get - Bob Vila,The Best Cordless Lamps You Can Get - Bob Vila,,
https://www.bobvila.com/articles/best-night-light/,The Best Night Lights,The Best Night Lights - Top Picks from Bob Vila,The Best Night Lights - Top Picks from Bob Vila,,
https://www.bobvila.com/articles/best-outdoor-christmas-decorations/,The Best Outdoor Christmas Decorations,Best Outdoor Christmas Decorations,Best Outdoor Christmas Decorations,,
https://www.bobvila.com/articles/best-bedroom-fan/,The Best Bedroom Fans You Can Get,The Best Bedroom Fans You Can Get - Bob Vila,The Best Bedroom Fans You Can Get - Bob Vila,,
https://www.bobvila.com/articles/best-halloween-decorations/,The 19 Best Halloween Decorations,The Best Halloween Decorations - Bob Vila,The Best Halloween Decorations - Bob Vila,,
https://www.bobvila.com/articles/best-smart-outdoor-lights/,"The Best Smart Outdoor Lights, Vetted","The Best Smart Outdoor Lights, Vetted %%sep%% Picks by %%sitename%%","The Best Smart Outdoor Lights, Vetted %%sep%% Picks by %%sitename%%",,
https://www.bobvila.com/articles/best-sectional-sofa/,The Best Sectional Sofas,The Best Sectional Sofas %%sep%% Picks by %%sitename%%,The Best Sectional Sofas %%sep%% Picks by %%sitename%%,,
https://www.bobvila.com/articles/best-guest-bed/,The Best Guest Beds,The Best Guest Beds for the Home - Bob Vila,The Best Guest Beds for the Home - Bob Vila,,
https://www.bobvila.com/articles/best-reclining-sofa/,The Best Reclining Sofas,The Best Reclining Sofas - Top Picks by Bob Vila,The Best Reclining Sofas - Top Picks by Bob Vila,,
https://www.bobvila.com/articles/best-loveseat/,The Best Loveseats,The Best Loveseats - Top Picks by Bob Vila,The Best Loveseats - Top Picks by Bob Vila,,
https://www.bobvila.com/articles/best-bean-bag-chairs/,The Best Bean Bag Chairs You Can Get,The Best Bean Bag Chairs You Can Get - Top Picks by Bob Vila,The Best Bean Bag Chairs You Can Get - Top Picks by Bob Vila,,
https://www.bobvila.com/articles/best-headboard/,The Best Headboards,The Best Headboards - Bob Vila,The Best Headboards - Bob Vila,,
https://www.bobvila.com/articles/best-sectionals-for-small-spaces/,The Best Sectionals for Small Spaces,The Best Sectionals for Small Spaces (2024) %%sep%% Picks from %%sitename%%,The Best Sectionals for Small Spaces (2024) %%sep%% Picks from %%sitename%%,,
https://www.bobvila.com/articles/labor-day-sales/,"The Best Labor Day Sales and Deals: End-of-Summer Discounts on Dyson, Samsung, Roomba, and More","The Best Labor Day Sales and Deals: End-of-Summer Discounts on Dyson, Samsung, Roomba, and More","The Best Labor Day Sales and Deals: End-of-Summer Discounts on Dyson, Samsung, Roomba, and More",,
https://www.bobvila.com/articles/best-painters-tape/,"The Best Painter’s Tape, Tested",The Best Painter's Tape Options - Tested by Bob Vila,The Best Painter's Tape Options - Tested by Bob Vila,,
https://www.bobvila.com/articles/best-random-orbital-sander/,"The Best Random Orbital Sanders, Tested and Reviewed",The Best Random Orbital Sanders %%sep%% Tested by %%sitename%%,The Best Random Orbital Sanders %%sep%% Tested by %%sitename%%,,
https://www.bobvila.com/articles/best-packing-tape/,The Best Packing Tapes You Can Get,The Best Packing Tapes You Can Get - Top Picks from Bob Vila,The Best Packing Tapes You Can Get - Top Picks from Bob Vila,,
https://www.bobvila.com/articles/best-home-improvement-loans/,,The Best Home Improvement Loans of 2024 - Picks by Bob Vila,The Best Home Improvement Loans of 2024 - Picks by Bob Vila,,
https://www.bobvila.com/articles/best-online-real-estate-schools/,The Best Online Real Estate Schools Today,The Best Online Real Estate Schools Today - Picks by Bob Vila,The Best Online Real Estate Schools Today - Picks by Bob Vila,,
https://www.bobvila.com/articles/best-home-warranty-companies-arizona/,The Best Home Warranty Companies in Arizona,The Best Home Warranty Companies in Arizona - Picks by Bob Vila,The Best Home Warranty Companies in Arizona - Picks by Bob Vila,,
https://www.bobvila.com/articles/best-home-warranty-in-west-virginia/,The Best Home Warranty Companies in West Virginia,The Best Home Warranty Companies in West Virginia - Picks by Bob Vila,The Best Home Warranty Companies in West Virginia - Picks by Bob Vila,,
https://www.bobvila.com/articles/best-shower-filter/,The Best Shower Filters,The Best Shower Filter Options - Top Picks by Bob Vila,The Best Shower Filter Options - Top Picks by Bob Vila,,
https://www.bobvila.com/articles/best-garbage-disposal/,The Best Garbage Disposals,The Best Garbage Disposal Options - Top Picks by Bob Vila,The Best Garbage Disposal Options - Top Picks by Bob Vila,,
https://www.bobvila.com/articles/best-mig-welders/,"The Best MIG Welders, Reviewed","The Best MIG Welders, Reviewed %%sep%% Picks from %%sitename%%","The Best MIG Welders, Reviewed %%sep%% Picks from %%sitename%%",,
https://www.bobvila.com/articles/best-canister-vacuum/,The Best Canister Vacuums You Can Get,The Best Canister Vacuums You Can Get - Picks from %%sitename%%,The Best Canister Vacuums You Can Get - Picks from %%sitename%%,,
https://www.bobvila.com/articles/best-touchless-vacuums/,The Best Touchless Vacuums,The Best Touchless Vacuums - Recommended by Bob Vila,The Best Touchless Vacuums - Recommended by Bob Vila,,
https://www.bobvila.com/articles/best-solar-companies-in-georgia/,The Best Solar Companies in Georgia,The Best Solar Companies in Georgia) - Picks by Bob Vila,The Best Solar Companies in Georgia) - Picks by Bob Vila,,
https://www.bobvila.com/articles/best-packing-services/,The Best Packing Services in America,The Best Packing Services in America - Picks by Bob Vila,The Best Packing Services in America - Picks by Bob Vila,,
https://www.bobvila.com/articles/best-bed-bug-exterminators/,The Best Bed Bug Exterminators in America,The Best Bed Bug Exterminators in America - Picks by Bob Vila,The Best Bed Bug Exterminators in America - Picks by Bob Vila,,
https://www.bobvila.com/articles/best-senior-moving-services/,The Best Senior Moving Services in America,The Best Senior Moving Services in America - Picks by Bob Vila,The Best Senior Moving Services in America - Picks by Bob Vila,,
https://www.bobvila.com/articles/best-bee-removal-services/,The Best Bee Removal Services in America,The Best Bee Removal Services in America - Picks by Bob Vila,The Best Bee Removal Services in America - Picks by Bob Vila,,
https://www.bobvila.com/articles/best-screwdriver-set/,"The 10 Best Screwdriver Sets of 2024, Tested and Reviewed","The 10 Best Screwdriver Sets of 2024, Tested and Reviewed","The 10 Best Screwdriver Sets of 2024, Tested and Reviewed",,
https://www.bobvila.com/articles/best-chair-mat-for-carpet/,The Best Chair Mats for Carpets Today,The Best Chair Mat for Carpet - Top Picks by Bob Vila,The Best Chair Mat for Carpet - Top Picks by Bob Vila,,
https://www.bobvila.com/articles/best-leaf-rake/,"The Best Leaf Rakes, Tested and Reviewed",The Best Leaf Rakes Tested in 2024 - Bob Vila,The Best Leaf Rakes Tested in 2024 - Bob Vila,,
https://www.bobvila.com/articles/best-apartment-security-systems/,The Best Apartment Security Systems of 2024,The Best Apartment Security Systems of 2024 - Picks by Bob Vila,The Best Apartment Security Systems of 2024 - Picks by Bob Vila,,
https://www.bobvila.com/articles/best-hearing-protection/,"The Best Hearing Protection, Tested",The Best Hearing Protection - Tested by Bob Vila,The Best Hearing Protection - Tested by Bob Vila,,
https://www.bobvila.com/articles/best-mattress/,The Best Mattresses,The Best Mattresses - Picks from Bob Vila,The Best Mattresses - Picks from Bob Vila,,
https://www.bobvila.com/articles/best-electric-coolers/,"The Best Electric Coolers, Vetted","The Best Electric Coolers, Vetted %%sep%% Picks by %%sitename%%","The Best Electric Coolers, Vetted %%sep%% Picks by %%sitename%%",,
https://www.bobvila.com/articles/best-mattress-pad/,The Best Mattress Pads of 2024,The Best Mattress Pads of 2024 - Bob Vila,The Best Mattress Pads of 2024 - Bob Vila,,
https://www.bobvila.com/articles/best-upholstered-beds/,The Best Upholstered Beds,The Best Upholstered Beds - Bob Vila,The Best Upholstered Beds - Bob Vila,"We found the best upholstered beds to shop. Check out our favorites from Amazon, Wayfair, AllModern, West Elm, and more.","We found the best upholstered beds to shop. Check out our favorites from Amazon, Wayfair, AllModern, West Elm, and more."
https://www.bobvila.com/articles/best-murphy-bed/,The Best Murphy Beds,The Best Murphy Beds %%sep%% Picks from %%sitename%%,The Best Murphy Beds %%sep%% Picks from %%sitename%%,,
https://www.bobvila.com/articles/best-mold-remover/,"The Best Mold Removers, Vetted",The Best Mold Remover Options - Top Picks by Bob Vila,The Best Mold Remover Options - Top Picks by Bob Vila,,
https://www.bobvila.com/articles/best-roller-shade/,The Best Roller Shades,The Best Roller Shades,The Best Roller Shades,,
https://www.bobvila.com/articles/best-tiny-house-loans/,,The Best Tiny-House Loans of 2024 - Picks by Bob Vila,The Best Tiny-House Loans of 2024 - Picks by Bob Vila,,
https://www.bobvila.com/articles/best-construction-loan-lenders/,,The Best Construction Loan Lenders of 2024 - Picks by Bob Vila,The Best Construction Loan Lenders of 2024 - Picks by Bob Vila,,
https://www.bobvila.com/articles/best-reverse-mortgage-companies/,,The Best Reverse Mortgage Companies of 2024 - Picks by Bob Vila,The Best Reverse Mortgage Companies of 2024 - Picks by Bob Vila,,
https://www.bobvila.com/articles/best-airbnb-florida/,The 15 Best Airbnbs in Florida,The 15 Best Airbnbs in Florida - Picks by Bob Vila,The 15 Best Airbnbs in Florida - Picks by Bob Vila,,
https://www.bobvila.com/articles/best-window-brands/,,The 12 Best Window Brands - Picks from Bob Vila,The 12 Best Window Brands - Picks from Bob Vila,,
https://www.bobvila.com/articles/best-cordless-hammer-drill/,"The Best Cordless Hammer Drills, Tested and Reviewed","The Best Cordless Hammer Drills, Tested - Top Picks by Bob Vila","The Best Cordless Hammer Drills, Tested - Top Picks by Bob Vila",,
https://www.bobvila.com/articles/best-right-angle-drill/,"The Best Right-Angle Drills, Tested","The Best Right-Angle Drills, Tested - Picks from Bob Vila","The Best Right-Angle Drills, Tested - Picks from Bob Vila",,
https://www.bobvila.com/articles/best-electric-screwdriver/,"The Best Electric Screwdrivers, Tested",The Best Electric Screwdrivers - Tested and Reviewed by Bob Vila,The Best Electric Screwdrivers - Tested and Reviewed by Bob Vila,,
https://www.bobvila.com/articles/best-hypoallergenic-laundry-detergent/,The Best Hypoallergenic Laundry Detergents,The Best Hypoallergenic Laundry Detergents - Top Picks from Bob Vila,The Best Hypoallergenic Laundry Detergents - Top Picks from Bob Vila,,
https://www.bobvila.com/articles/best-leather-cleaner/,The Best Leather Cleaners,The Best Leather Cleaners %%sep%% Picks by %%sitename%%,The Best Leather Cleaners %%sep%% Picks by %%sitename%%,,
https://www.bobvila.com/articles/best-hardwood-floor-cleaner/,"The Best Hardwood Floor Cleaners, Vetted","The Best Hardwood Floor Cleaners, Vetted - Top Picks from Bob Vila","The Best Hardwood Floor Cleaners, Vetted - Top Picks from Bob Vila",,
https://www.bobvila.com/articles/best-dual-fuel-ranges/,"The Best Dual-Fuel Ranges, Vetted",The Best Dual Fuel Ranges %%sep%% Picks from %%sitename%%,The Best Dual Fuel Ranges %%sep%% Picks from %%sitename%%,,
https://www.bobvila.com/articles/best-caulking-gun/,"The Best Caulking Guns, Tested","The Best Caulking Guns, Tested - Picks by Bob Vila","The Best Caulking Guns, Tested - Picks by Bob Vila",,
https://www.bobvila.com/articles/best-freestanding-tubs/,"The Best Freestanding Tubs, Reviewed","The Best Freestanding Tubs, Reviewed %%sep%% Picks from %%sitename%%","The Best Freestanding Tubs, Reviewed %%sep%% Picks from %%sitename%%",,
https://www.bobvila.com/articles/best-expanding-foam/,"The Best Expanding Foams, Vetted","The Best Expanding Foams, Vetted - Top Picks by Bob Vila","The Best Expanding Foams, Vetted - Top Picks by Bob Vila",,
https://www.bobvila.com/articles/best-glue-for-metal/,The Best Glue for Metal,Best Glue for Metal - Picks from Bob Vila,Best Glue for Metal - Picks from Bob Vila,,
https://www.bobvila.com/articles/best-double-sided-tape/,The Best Double-Sided Tapes,The Best Double-Sided Tapes - Bob Vila,The Best Double-Sided Tapes - Bob Vila,,
https://www.bobvila.com/articles/best-silicone-spray/,"The Best Silicone Sprays, Vetted","The Best Silicone Sprays, Vetted - Top Picks by Bob Vila","The Best Silicone Sprays, Vetted - Top Picks by Bob Vila",,
https://www.bobvila.com/articles/best-frameless-shower-doors/,The Best Frameless Shower Doors,The Best Frameless Shower Doors - Top Picks from Bob Vila,The Best Frameless Shower Doors - Top Picks from Bob Vila,,
https://www.bobvila.com/articles/best-bidet/,The Best Bidets,The Best Bidets - Top Picks by Bob Vila,The Best Bidets - Top Picks by Bob Vila,,
https://www.bobvila.com/articles/best-freestanding-tub-faucet/,The Best Freestanding Tub Faucets,The Best Freestanding Tub Faucets %%sep%% Picks by %%sitename%%,The Best Freestanding Tub Faucets %%sep%% Picks by %%sitename%%,,
https://www.bobvila.com/articles/best-sprinkler-pump/,"The Best Sprinkler Pumps, Vetted","The Best Sprinkler Pumps, Vetted - Top Picks from Bob Vila","The Best Sprinkler Pumps, Vetted - Top Picks from Bob Vila",,
https://www.bobvila.com/articles/best-french-door-refrigerator/,The Best French-Door Refrigerators,The Best French Door Refrigerators - Top Picks from Bob Vila,The Best French Door Refrigerators - Top Picks from Bob Vila,,
https://www.bobvila.com/articles/best-top-freezer-refrigerator/,The Best Top-Freezer Refrigerators,The Best Top Freezer Refrigerators - Bob Vila,The Best Top Freezer Refrigerators - Bob Vila,,
https://www.bobvila.com/articles/best-whirlpool-refrigerators/,The Best Whirlpool Refrigerators You Can Get,The Best Whirlpool Refrigerators You Can Get %%sep%% Picks from %%sitename%%,The Best Whirlpool Refrigerators You Can Get %%sep%% Picks from %%sitename%%,,
https://www.bobvila.com/articles/best-ge-refrigerator/,The Best GE Refrigerators You Can Get,The Best GE Refrigerators You Can Get %%sep%% Picks by %%sitename%%,The Best GE Refrigerators You Can Get %%sep%% Picks by %%sitename%%,,
https://www.bobvila.com/articles/best-cookware-brands/,,The Best Cookware Brands - Bob Vila,The Best Cookware Brands - Bob Vila,,
https://www.bobvila.com/articles/best-ultrasonic-pest-repeller/,,The 9 Best Ultrasonic Pest Repellers - Top Picks by Bob Vila,The 9 Best Ultrasonic Pest Repellers - Top Picks by Bob Vila,,
https://www.bobvila.com/articles/best-insecticide/,The Best Insecticides of 2024,The Best Insecticides You Can Get in 2024 - Bob Vila,The Best Insecticides You Can Get in 2024 - Bob Vila,,
https://www.bobvila.com/articles/best-skunk-repellents/,"The Best Skunk Repellents, Vetted","The Best Skunk Repellents, Vetted (2024) - Reviewed by Bob Vila","The Best Skunk Repellents, Vetted (2024) - Reviewed by Bob Vila",,
https://www.bobvila.com/articles/best-portable-water-filter/,"The Best Portable Water Filters, Vetted","The Best Portable Water Filters, Vetted - Bob Vila","The Best Portable Water Filters, Vetted - Bob Vila",,
https://www.bobvila.com/articles/best-wheeled-cooler/,"The Best Wheeled Coolers, Tested",The Best Wheeled Coolers - Tested by Bob Vila,The Best Wheeled Coolers - Tested by Bob Vila,,
https://www.bobvila.com/articles/best-telescoping-ladder/,"The Best Telescoping Ladders, Tested and Reviewed",The Best Telescoping Ladder Options - Tested by Bob Vila,The Best Telescoping Ladder Options - Tested by Bob Vila,,
https://www.bobvila.com/articles/best-power-recliners/,The Best Power Recliners,The Best Power Recliners - Picks by Bob Vila,The Best Power Recliners - Picks by Bob Vila,,
https://www.bobvila.com/articles/best-roman-shades/,The Best Roman Shades,The Best Roman Shades - Top Picks by Bob Vila,The Best Roman Shades - Top Picks by Bob Vila,,
https://www.bobvila.com/articles/best-fertilizer-for-tomatoes/,,The Best Fertilizer for Tomatoes You Can Get - Bob Vila,The Best Fertilizer for Tomatoes You Can Get - Bob Vila,,
https://www.bobvila.com/articles/best-grease-gun/,,The Best Grease Guns for Car Repairs - Bob Vila,The Best Grease Guns for Car Repairs - Bob Vila,,
https://www.bobvila.com/articles/best-cheap-moving-services/,The Best Cheap Moving Services in America,Best Cheap Moving Services in America - Picks by Bob Vila,Best Cheap Moving Services in America - Picks by Bob Vila,,
https://www.bobvila.com/articles/best-moving-truck-rental-companies/,The Best Moving Truck Rental Companies,The Best Moving Truck Rental Companies - Picks by Bob Vila,The Best Moving Truck Rental Companies - Picks by Bob Vila,,
https://www.bobvila.com/articles/best-moving-companies-los-angeles/,"The Best Moving Companies in Los Angeles, California,","The Best Moving Companies in Los Angeles, California, - Picks by Bob Vila","The Best Moving Companies in Los Angeles, California, - Picks by Bob Vila",,
https://www.bobvila.com/articles/best-moving-companies-in-california/,The Best Moving Companies in California,The Best Moving Companies in California - Picks by Bob Vila,The Best Moving Companies in California - Picks by Bob Vila,,
https://www.bobvila.com/articles/best-moving-companies-san-francisco/,"The Best Moving Companies in San Francisco, California","The Best Moving Companies in San Francisco, California - Picks by Bob Vila","The Best Moving Companies in San Francisco, California - Picks by Bob Vila",,
https://www.bobvila.com/articles/best-military-moving-companies/,The Best Military Moving Companies in America,The Best Military Moving Companies in America - Picks by Bob Vila,The Best Military Moving Companies in America - Picks by Bob Vila,,
https://www.bobvila.com/articles/best-moving-companies-in-san-diego/,The Best Moving Companies in San Diego,The Best Moving Companies in San Diego - Picks by Bob Vila,The Best Moving Companies in San Diego - Picks by Bob Vila,,
https://www.bobvila.com/articles/best-insurance-for-lawn-care-businesses/,The Best Insurance for Lawn Care Businesses,The Best Insurance for Lawn Care Businesses - Picks by Bob Vila,The Best Insurance for Lawn Care Businesses - Picks by Bob Vila,,
https://www.bobvila.com/articles/best-online-landscape-design-courses/,"The Best Online Landscape Design Courses, Reviewed",The Best Online Landscape Design Courses (2024) - Picks by Bob Vila,The Best Online Landscape Design Courses (2024) - Picks by Bob Vila,,
https://www.bobvila.com/articles/best-vacuum-for-thick-carpet/,The Best Vacuums for Thick Carpet,The Best Vacuums for Thick Carpet - Picks by Bob Vila,The Best Vacuums for Thick Carpet - Picks by Bob Vila,,
