id,post_title,seo_title,meta__yoast_wpseo_title,seo_description,meta__yoast_wpseo_metadesc
https://www.bobvila.com/articles/best-gas-lawn-mower/,,The Best Gas Lawn Mower Options - Top Picks by Bob Vila,The Best Gas Lawn Mower Options - Top Picks by Bob Vila,,
https://www.bobvila.com/articles/best-lawn-care-products/,,"The 12 Best Lawn Care Products for a Healthy, Beautiful Yard","The 12 Best Lawn Care Products for a Healthy, Beautiful Yard",,
https://www.bobvila.com/articles/best-trees-as-gifts/,The 21 Best Trees as Gifts,The 14 Best Trees as Gifts - Tree Gift Ideas from Bob Vila,The 14 Best Trees as Gifts - Tree Gift Ideas from Bob Vila,,
https://www.bobvila.com/articles/best-air-conditioner/,"The Best Air Conditioners, Tested","The Best Air Conditioners, Tested - Recommendations from Bob Vila","The Best Air Conditioners, Tested - Recommendations from Bob Vila",,
https://www.bobvila.com/articles/best-ductless-air-conditioner/,"The Best Ductless Air Conditioners, Reviewed","The Best Ductless Air Conditioners, Reviewed - Top Picks by Bob Vilas","The Best Ductless Air Conditioners, Reviewed - Top Picks by Bob Vilas",,
https://www.bobvila.com/articles/best-u-shaped-air-conditioners/,"The Best U-Shaped Air Conditioners, Vetted","The Best U-Shaped Air Conditioners, Vetted %%sep%% Picks by %%sitename%%","The Best U-Shaped Air Conditioners, Vetted %%sep%% Picks by %%sitename%%",,
https://www.bobvila.com/articles/best-energy-efficient-air-conditioners/,The Best Energy-Efficient Air Conditioners,The Best Energy Efficient Air Conditioners %%sep%% Picks from %%sitename%%,The Best Energy Efficient Air Conditioners %%sep%% Picks from %%sitename%%,,
https://www.bobvila.com/articles/best-mold-removal-companies/,The Best Mold Removal Companies in America,The Best Mold Removal Companies in America - Picks by Bob Vila,The Best Mold Removal Companies in America - Picks by Bob Vila,,
https://www.bobvila.com/articles/best-barn-doors/,The Best Barn Doors You Can Get,The Best Barn Doors You Can Get - Bob Vila,The Best Barn Doors You Can Get - Bob Vila,,
https://www.bobvila.com/articles/best-door-knobs/,The Best Door Knobs,The Best Door Knobs - Top Picks from Bob Vila,The Best Door Knobs - Top Picks from Bob Vila,,
https://www.bobvila.com/articles/best-work-gloves/,"The Best Work Gloves of 2024, Tested and Reviewed","The Best Work Gloves of 2024, Tested and Reviewed","The Best Work Gloves of 2024, Tested and Reviewed",,
https://www.bobvila.com/articles/best-winter-work-gloves/,"The Best Winter Work Gloves, According to Testing","The Best Winter Work Gloves, According to Testing","The Best Winter Work Gloves, According to Testing",,
https://www.bobvila.com/articles/best-boot-dryer/,The 8 Best Boot Dryers of 2024,The 8 Best Boot Dryers of 2024 - Reviewed by Bob Vila,The 8 Best Boot Dryers of 2024 - Reviewed by Bob Vila,,
https://www.bobvila.com/articles/best-hard-hat-light/,"The Best Hard Hat Lights, Tested","The Best Hard Hat Lights, Tested - Picks by Bob Vila","The Best Hard Hat Lights, Tested - Picks by Bob Vila",,
https://www.bobvila.com/articles/best-heated-jacket/,The Best Heated Jackets,The Best Heated Jackets - Picks from Bob Vila,The Best Heated Jackets - Picks from Bob Vila,,
https://www.bobvila.com/articles/best-welder/,"The Best Welders, Reviewed","The Best Welders, Reviewed - Top Picks by Bob Vila","The Best Welders, Reviewed - Top Picks by Bob Vila",,
https://www.bobvila.com/articles/best-sheds/,The Best Sheds You Can Get,The Best Sheds You Can Get - Picks by Bob Vila,The Best Sheds You Can Get - Picks by Bob Vila,,
https://www.bobvila.com/articles/best-gazebo/,The Best Gazebos,The Best Gazebos - Recommendations from Bob Vila,The Best Gazebos - Recommendations from Bob Vila,,
https://www.bobvila.com/articles/best-chicken-coop/,The Best Chicken Coops,The Best Chicken Coops of Today %%sep%% Picks from %%sitename%%,The Best Chicken Coops of Today %%sep%% Picks from %%sitename%%,,
https://www.bobvila.com/articles/best-electric-fireplace-tv-stands/,,The 9 Best Electric Fireplace TV Stands,The 9 Best Electric Fireplace TV Stands,,
https://www.bobvila.com/articles/best-fence-companies/,The Best Fence Companies in America,The Best Fence Companies in America - Picks by Bob Vila,The Best Fence Companies in America - Picks by Bob Vila,,
https://www.bobvila.com/articles/best-hose-reel/,,The Best Hose Reels Tested,The Best Hose Reels Tested,,
https://www.bobvila.com/articles/best-top-loading-washing-machine/,"The Best Top-Loading Washing Machines, Reviewed","The Best Top-Loading Washing Machines, Reviewed - Top Picks by Bob Vila","The Best Top-Loading Washing Machines, Reviewed - Top Picks by Bob Vila",,
https://www.bobvila.com/articles/best-washer-and-dryer/,The Best Washers and Dryers Today,The Best Washers and Dryers Today - Top Picks by Bob Vila,The Best Washers and Dryers Today - Top Picks by Bob Vila,,
https://www.bobvila.com/articles/best-stackable-washer-and-dryer/,"The Best Stackable Washer Dryers, Reviewed","The Best Stackable Washer Dryers, Reviewed - Top Picks by Bob Vila","The Best Stackable Washer Dryers, Reviewed - Top Picks by Bob Vila",,
https://www.bobvila.com/articles/best-washing-machine-cleaner/,"The Best Washing Machine Cleaners, Vetted",The Best Washing Machine Cleaner Options Today - Top Picks by Bob Vila,The Best Washing Machine Cleaner Options Today - Top Picks by Bob Vila,,
https://www.bobvila.com/articles/best-soap-scum-remover/,The Best Soap Scum Removers,The Best Soap Scum Removers - Top Picks by Bob Vila,The Best Soap Scum Removers - Top Picks by Bob Vila,,
https://www.bobvila.com/articles/best-tub-refinishing-kit/,"The Best Tub Refinishing Kits, Vetted","The Best Tub Refinishing Kit Options, Vetted - Top Picks by Bob Vila","The Best Tub Refinishing Kit Options, Vetted - Top Picks by Bob Vila",,
https://www.bobvila.com/articles/best-tiles-for-shower-walls/,The Best Tiles for Shower Walls,The Best Tiles for Shower Walls %%sep%% Picks from %%sitename%%,The Best Tiles for Shower Walls %%sep%% Picks from %%sitename%%,,
https://www.bobvila.com/articles/best-electric-mops/,"The Best Electric Mops, Tested",The Best Electric Mops Tested and Reviewed - Bob Vila,The Best Electric Mops Tested and Reviewed - Bob Vila,,
https://www.bobvila.com/articles/best-solar-batteries/,,The 5 Best Solar Batteries for Storing Usable Energy ,The 5 Best Solar Batteries for Storing Usable Energy ,,
https://www.bobvila.com/articles/best-solar-companies-in-southern-california/,The Best Solar Companies in Southern California,The Best Solar Companies in Southern California - Picks by Bob Vila,The Best Solar Companies in Southern California - Picks by Bob Vila,,
https://www.bobvila.com/articles/best-solar-companies-in-maryland/,The Best Solar Companies in Maryland,The Best Solar Companies in Maryland - Picks by Bob Vila,The Best Solar Companies in Maryland - Picks by Bob Vila,,
https://www.bobvila.com/articles/best-solar-companies-in-virginia/,The Best Solar Companies in Virginia,The Best Solar Companies in Virginia - Picks by Bob Vila,The Best Solar Companies in Virginia - Picks by Bob Vila,,
https://www.bobvila.com/articles/best-solar-companies-in-illinois/,The Best Solar Companies in Illinois,The Best Solar Companies in Illinois - Picks by Bob Vila,The Best Solar Companies in Illinois - Picks by Bob Vila,,
https://www.bobvila.com/articles/best-landscaping-companies/,The Best Landscaping Companies,The Best Landscaping Company Options - Picks by Bob Vila,The Best Landscaping Company Options - Picks by Bob Vila,,
https://www.bobvila.com/articles/best-lawn-care-companies-atlanta/,"The Best Lawn Care Companies in Atlanta, Georgia","The Best Lawn Care Companies in Atlanta, Georgia - Picks by Bob Vila","The Best Lawn Care Companies in Atlanta, Georgia - Picks by Bob Vila",,
https://www.bobvila.com/articles/best-christmas-decorations/,The Best Christmas Decorations,The Best Christmas Decorations - Picks from Bob Vila,The Best Christmas Decorations - Picks from Bob Vila,,
https://www.bobvila.com/articles/best-christmas-lights/,,"10 Best Christmas Lights, Tested and Reviewed","10 Best Christmas Lights, Tested and Reviewed",,
https://www.bobvila.com/articles/best-christmas-tree-toppers/,,Thee 14 Best Christmas Tree Toppers ,Thee 14 Best Christmas Tree Toppers ,,
https://www.bobvila.com/articles/best-christmas-tree-stand/,,Editor-Picked: The Best Christmas Tree Stands,Editor-Picked: The Best Christmas Tree Stands,,
https://www.bobvila.com/articles/best-rotating-christmas-tree-stand/,,The 7 Best Rotating Christmas Tree Stands,The 7 Best Rotating Christmas Tree Stands,,
https://www.bobvila.com/articles/best-christmas-ornaments/,The 28 Best Christmas Ornaments,The 28 Best Christmas Ornaments - Recommended by Bob Vila,The 28 Best Christmas Ornaments - Recommended by Bob Vila,,
https://www.bobvila.com/articles/best-christmas-inflatable/,The Best Christmas Inflatables,The 14 Best Christmas Inflatables - Reviewed by Bob Vila,The 14 Best Christmas Inflatables - Reviewed by Bob Vila,,
https://www.bobvila.com/articles/best-gifts-for-mechanics/,,The 29 Best Gifts for Mechanics and Auto Fanatics,The 29 Best Gifts for Mechanics and Auto Fanatics,,
https://www.bobvila.com/articles/gifts-for-woodworkers/,,"The 42 Best Gifts for Woodworkers - Editor Approved, Bob Vila","The 42 Best Gifts for Woodworkers - Editor Approved, Bob Vila",,
https://www.bobvila.com/articles/gifts-for-gardeners/,,32 Best Gifts for Gardeners - Useful Gardening Gifts from Bob Vila,32 Best Gifts for Gardeners - Useful Gardening Gifts from Bob Vila,,
https://www.bobvila.com/articles/hostess-gifts/,,26 Best Hostess Gifts - Useful Gift Ideas from Bob Vila,26 Best Hostess Gifts - Useful Gift Ideas from Bob Vila,,
https://www.bobvila.com/articles/gifts-for-new-homeowners/,,35 Best Gifts for New Homeowners - Gift Ideas From Bob Vila,35 Best Gifts for New Homeowners - Gift Ideas From Bob Vila,,
https://www.bobvila.com/articles/best-water-damage-restoration-services/,The Best Water Damage Restoration Services,The Best Water Damage Restoration Services - Bob Vila,The Best Water Damage Restoration Services - Bob Vila,,
https://www.bobvila.com/articles/best-termite-treatment/,"The Best Termite Treatments, Vetted","The Best Termite Treatments, Vetted - Top Picks by Bob Vila","The Best Termite Treatments, Vetted - Top Picks by Bob Vila",,
https://www.bobvila.com/articles/best-invisible-dog-fence/,,The Best Invisible Dog Fences- Top Picks by Bob Vila,The Best Invisible Dog Fences- Top Picks by Bob Vila,,
https://www.bobvila.com/articles/best-gate-latch/,The Best Gate Latches,The Best Gate Latches - Top Picks by Bob Vila,The Best Gate Latches - Top Picks by Bob Vila,,
https://www.bobvila.com/articles/best-mouse-exterminators/,The Best Mouse Exterminators in America,The Best Mouse Exterminators in America - Bob Vila,The Best Mouse Exterminators in America - Bob Vila,,
https://www.bobvila.com/articles/best-cockroach-exterminators/,The Best Cockroach Exterminators in America,The Best Cockroach Exterminators in America - Picks by Bob Vila,The Best Cockroach Exterminators in America - Picks by Bob Vila,,
https://www.bobvila.com/articles/best-llc-services/,,The Best LLC Services of 2024 - Picks by Bob Vila,The Best LLC Services of 2024 - Picks by Bob Vila,,
https://www.bobvila.com/articles/best-small-business-insurance/,The Best Small-Business Insurance Today,The Best Small-Business Insurance Today - Picks by Bob Vila,The Best Small-Business Insurance Today - Picks by Bob Vila,,
https://www.bobvila.com/articles/best-pest-control-companies-tampa/,"The Best Pest Control Companies in Tampa, Florida,","The Best Pest Control Companies in Tampa, Florida, - Picks by Bob Vila","The Best Pest Control Companies in Tampa, Florida, - Picks by Bob Vila",,
https://www.bobvila.com/articles/best-pest-control-in-houston/,"The Best Pest Control Companies in Houston, Texas","The Best Pest Control in Houston, Texas - Picks by Bob Vila","The Best Pest Control in Houston, Texas - Picks by Bob Vila",,
https://www.bobvila.com/articles/best-wood-burning-fireplace-insert/,The Best Wood-Burning Fireplace Inserts of 2024,The Best Wood-Burning Fireplace Inserts of 2024 %%sep%% Picks from %%sitename%%,The Best Wood-Burning Fireplace Inserts of 2024 %%sep%% Picks from %%sitename%%,,
https://www.bobvila.com/articles/best-gas-fireplace-insert/,The Best Gas Fireplace Inserts of 2024,The Best Gas Fireplace Inserts of 2024 - Bob Vila,The Best Gas Fireplace Inserts of 2024 - Bob Vila,,
https://www.bobvila.com/articles/best-washing-machine-hoses/,The Best Washing Machine Hoses,The Best Washing Machine Hoses - Bob Vila,The Best Washing Machine Hoses - Bob Vila,,
https://www.bobvila.com/articles/best-window-air-conditioners/,The Best Window Air Conditioners,The Best Window Air Conditioners - Picks from Bob Vila,The Best Window Air Conditioners - Picks from Bob Vila,,
https://www.bobvila.com/articles/best-hybrid-grills/,The Best Hybrid Grills,The Best Hybrid Grills - Picks by Bob Vila,The Best Hybrid Grills - Picks by Bob Vila,,
https://www.bobvila.com/articles/best-website-builders-for-small-business/,The 6 Best Website Builders for Small Business Owners,The 6 Best Website Builders for Small Business Owners (2024) - Bob Vila,The 6 Best Website Builders for Small Business Owners (2024) - Bob Vila,,
https://www.bobvila.com/articles/best-place-to-buy-moving-boxes/,,The Best Places to Buy Moving Boxes,The Best Places to Buy Moving Boxes,,
https://www.bobvila.com/articles/best-septic-tank-treatment/,"The Best Septic Tank Treatments, Reviewed","The Best Septic Tank Treatments, Reviewed - Top Picks by Bob Vila","The Best Septic Tank Treatments, Reviewed - Top Picks by Bob Vila",,
https://www.bobvila.com/articles/best-locking-mailbox/,,The Best Locking Mailbox Options - Top Picks by Bob Vila,The Best Locking Mailbox Options - Top Picks by Bob Vila,,
https://www.bobvila.com/articles/best-gas-can/,The Best Gas Cans,The Best Gas Cans (2024) - Top Picks by Bob Vila,The Best Gas Cans (2024) - Top Picks by Bob Vila,,
https://www.bobvila.com/articles/best-mortgage-lenders-in-florida/,The Best Mortgage Lenders in Florida,The Best Mortgage Lenders in Florida (2024) - Picks by Bob Vila,The Best Mortgage Lenders in Florida (2024) - Picks by Bob Vila,,
https://www.bobvila.com/articles/best-siding-nailer/,"The Best Siding Nailers, Reviewed","The Best Siding Nailers, Reviewed - Picks by Bob Vila","The Best Siding Nailers, Reviewed - Picks by Bob Vila",,
https://www.bobvila.com/articles/best-exterior-paint/,"The Best Exterior Paints, Reviewed","The Best Exterior Paints, Reviewed - Picks by Bob Vila","The Best Exterior Paints, Reviewed - Picks by Bob Vila",,
https://www.bobvila.com/articles/best-work-boots-for-concrete/,The Best Work Boots for Concrete,The Best Work Boots for Concrete %%sep%% Picks by %%sitename%%,The Best Work Boots for Concrete %%sep%% Picks by %%sitename%%,,
https://www.bobvila.com/articles/best-handyman-insurance-companies/,,The Best Handyman Insurance Companies of 2024 - Picks by Bob Vila,The Best Handyman Insurance Companies of 2024 - Picks by Bob Vila,,
https://www.bobvila.com/articles/best-keypad-door-lock/,The Best Keypad Door Locks of 2024,The Best Keypad Door Locks of 2024 - Top Picks by Bob Vila,The Best Keypad Door Locks of 2024 - Top Picks by Bob Vila,,
https://www.bobvila.com/articles/best-keyless-door-lock/,The Best Keyless Door Locks,The Best Keyless Door Lock Systems- Top Picks from Bob Vila,The Best Keyless Door Lock Systems- Top Picks from Bob Vila,,
https://www.bobvila.com/articles/best-home-warranty-companies-in-texas/,The Best Home Warranty Companies in Texas,The Best Home Warranty Companies in Texas (2024) - Picks by Bob Vila,The Best Home Warranty Companies in Texas (2024) - Picks by Bob Vila,,
https://www.bobvila.com/articles/best-home-warranty-california/,The Best Home Warranty Companies in California,The Best Home Warranty Companies in California (2024) - Picks by Bob Vila,The Best Home Warranty Companies in California (2024) - Picks by Bob Vila,,
https://www.bobvila.com/articles/best-home-warranty-florida/,The Best Home Warranty Companies in Florida,The Best Home Warranty Companies in Florida (2024) - Picks by Bob Vila,The Best Home Warranty Companies in Florida (2024) - Picks by Bob Vila,,
https://www.bobvila.com/articles/best-push-mower/,"The Best Push Lawn Mowers, Tested and Reviewed","The Best Push Mowers, Tested & Reviewed (2024) - Picks from %%sitename%%","The Best Push Mowers, Tested & Reviewed (2024) - Picks from %%sitename%%",,
https://www.bobvila.com/articles/best-electric-mowers/,"The Best Electric Mowers, Tested",The Best Electric Mowers - Tested by Bob Vila,The Best Electric Mowers - Tested by Bob Vila,,
https://www.bobvila.com/articles/best-riding-lawn-mower/,"The Best Riding Lawn Mowers, Tested and Reviewed","The Best Riding Lawn Mowers, Tested & Reviewed by Bob Vila","The Best Riding Lawn Mowers, Tested & Reviewed by Bob Vila",,
https://www.bobvila.com/articles/best-self-propelled-lawn-mower/,"The Best Self-Propelled Lawn Mowers, Tested and Reviewed","The Best Self-Propelled Lawn Mowers, Tested - Picks from %%sitename%%","The Best Self-Propelled Lawn Mowers, Tested - Picks from %%sitename%%",,
https://www.bobvila.com/articles/best-mosquito-control-services/,The Best Mosquito Control Services in America,The Best Mosquito Control Services in America - Picks by Bob Vila,The Best Mosquito Control Services in America - Picks by Bob Vila,,
https://www.bobvila.com/articles/best-moving-companies-for-small-moves/,The 7 Best Moving Companies for Small Moves,The 7 Best Moving Companies for Small Moves (2024) - Picks by Bob Vila,The 7 Best Moving Companies for Small Moves (2024) - Picks by Bob Vila,,
https://www.bobvila.com/articles/best-moving-insurance-companies/,The Best Moving Insurance Companies in America,The Best Moving Insurance Companies in America - Picks by Bob Vila,The Best Moving Insurance Companies in America - Picks by Bob Vila,,
https://www.bobvila.com/articles/best-interstate-moving-companies/,The Best Interstate Moving Companies Today,The Best Interstate Moving Companies Today - Picks by Bob Vila,The Best Interstate Moving Companies Today - Picks by Bob Vila,,
https://www.bobvila.com/articles/best-composting-toilet/,"The Best Composting Toilets, Reviewed","The Best Composting Toilets, Reviewed - Top Picks by Bob Vila","The Best Composting Toilets, Reviewed - Top Picks by Bob Vila",,
https://www.bobvila.com/articles/best-bathroom-scrubber/,,The Best Bathroom Scrubber to Remove Tough Stains - Bob Vila,The Best Bathroom Scrubber to Remove Tough Stains - Bob Vila,,
https://www.bobvila.com/articles/best-peel-and-stick-backsplash/,The Best Peel-and-Stick Backsplashes Today,The Best Peel-and-Stick Backsplashes Today - Bob Vila,The Best Peel-and-Stick Backsplashes Today - Bob Vila,,
https://www.bobvila.com/articles/best-wall-safe/,,The Best Wall Safe Options for the Home - Bob Vila,The Best Wall Safe Options for the Home - Bob Vila,,
https://www.bobvila.com/articles/best-air-purifier-for-wildfire-smoke/,The 9 Best Air Purifiers for Wildfire Smoke,The 9 Best Air Purifiers for Wildfire Smoke of 2024 - Reviewed by Bob Vila,The 9 Best Air Purifiers for Wildfire Smoke of 2024 - Reviewed by Bob Vila,,
https://www.bobvila.com/articles/best-driveway-alarm/,The Best Driveway Alarms of 2024,The Best Driveway Alarms of 2024 - Top Picks by Bob Vila,The Best Driveway Alarms of 2024 - Top Picks by Bob Vila,,
https://www.bobvila.com/articles/best-carbon-monoxide-detector/,"The Best Carbon Monoxide Detectors, Tested",The Best Carbon Monoxide Detectors - Tested by Bob Vila,The Best Carbon Monoxide Detectors - Tested by Bob Vila,,
https://www.bobvila.com/articles/best-snake-repellent/,"The Best Snake Repellents, Vetted","The Best Snake Repellents, Vetted - Top Picks by Bob Vila","The Best Snake Repellents, Vetted - Top Picks by Bob Vila",,
https://www.bobvila.com/articles/asbestos-removal-cost/,,Factors and Considerations That Go Into Asbestos Removal Cost ,Factors and Considerations That Go Into Asbestos Removal Cost ,,
https://www.bobvila.com/articles/best-shower-doors/,The Best Shower Doors,The Best Shower Doors- Bob Vila,The Best Shower Doors- Bob Vila,,
https://www.bobvila.com/articles/best-compact-greenhouse/,The Best Compact Greenhouses Today,The Best Compact Greenhouses Today - Picks from %%sitename%%,The Best Compact Greenhouses Today - Picks from %%sitename%%,,
https://www.bobvila.com/articles/best-greenhouse-plastic/,The Best Greenhouse Plastic,The Best Greenhouse Plastics - Bob Vila,The Best Greenhouse Plastics - Bob Vila,,
https://www.bobvila.com/articles/best-led-light-bulbs/,"The Best LED Light Bulbs, Vetted","The Best LED Light Bulbs, Vetted - Top Picks by Bob Vila","The Best LED Light Bulbs, Vetted - Top Picks by Bob Vila",,
https://www.bobvila.com/articles/best-compost-tumbler/,"The Best Compost Tumblers, Tested and Reviewed","The Best Compost Tumblers, %%sep%% Picks Tested & Reviewed from %%sitename%%","The Best Compost Tumblers, %%sep%% Picks Tested & Reviewed from %%sitename%%",,
https://www.bobvila.com/articles/best-gutter-guards/,We Tested the Best Gutter Guards—These Are Our Favorites,"The Best Gutter Guards, Tested & Reviewed - Bob Vila","The Best Gutter Guards, Tested & Reviewed - Bob Vila",,
https://www.bobvila.com/articles/best-ornament-storage/,,12 Top Solutions for the Best Ornament Storage,12 Top Solutions for the Best Ornament Storage,,
https://www.bobvila.com/articles/best-rental-listing-sites/,The Best Rental Listing Sites for Home Seekers Today,The Best Rental Listing Sites for Home Seekers Today - Bob Vila,The Best Rental Listing Sites for Home Seekers Today - Bob Vila,,
https://www.bobvila.com/articles/best-home-warranties-for-rental-property/,The Best Home Warranties for Rental Properties,The Best Home Warranties for Rental Properties - Picks by Bob Vila,The Best Home Warranties for Rental Properties - Picks by Bob Vila,,
https://www.bobvila.com/articles/best-home-warranty-for-landlords/,The Best Home Warranties for Landlords,The Best Home Warranties for Landlords - Picks by Bob Vila,The Best Home Warranties for Landlords - Picks by Bob Vila,,
https://www.bobvila.com/articles/best-electric-can-opener/,,The 8 Best Electric Can Openers for the Kitchen ,The 8 Best Electric Can Openers for the Kitchen ,,
https://www.bobvila.com/articles/best-kitchen-trash-can/,"The Best Kitchen Trash Cans, Tested and Reviewed",The Best Kitchen Trash Can Options - Tested by Bob Vila,The Best Kitchen Trash Can Options - Tested by Bob Vila,,
https://www.bobvila.com/articles/best-home-intercom-system/,The Best Home Intercom Systems,The Best Home Intercom Systems %%sep%% Picks %%sitename%%,The Best Home Intercom Systems %%sep%% Picks %%sitename%%,,
https://www.bobvila.com/articles/best-wireless-doorbell/,"The Best Wireless Doorbells, Reviewed",The Best Wireless Doorbells - Top Picks by Bob Vila,The Best Wireless Doorbells - Top Picks by Bob Vila,,
https://www.bobvila.com/articles/best-doorbell/,The Best Doorbells,The Best Doorbells - Recommendations by Bob Vila,The Best Doorbells - Recommendations by Bob Vila,,
https://www.bobvila.com/articles/best-room-humidifier/,,10 Best Room Humidifier Options for Fixing Dry Indoor Air ,10 Best Room Humidifier Options for Fixing Dry Indoor Air ,,
https://www.bobvila.com/articles/best-doorbell-cameras/,The Best Doorbell Cameras,The Best Doorbell Camera Options - Top Picks by Bob Vila,The Best Doorbell Camera Options - Top Picks by Bob Vila,,
https://www.bobvila.com/articles/best-video-doorbells/,The Best Video Doorbells,The Best Video Doorbells - Recommendations by Bob Vila,The Best Video Doorbells - Recommendations by Bob Vila,,
https://www.bobvila.com/articles/best-projection-alarm-clock/,,The Best Projection Alarm Clocks - Reviewed by Bob Vila,The Best Projection Alarm Clocks - Reviewed by Bob Vila,,
https://www.bobvila.com/articles/best-medicine-cabinets/,The Best Medicine Cabinets,The Best Medicine Cabinets - Picks from Bob Vila,The Best Medicine Cabinets - Picks from Bob Vila,,
https://www.bobvila.com/articles/best-home-equity-loans/,,The Best Home Equity Loans of 2024 - Picks by Bob Vila,The Best Home Equity Loans of 2024 - Picks by Bob Vila,,
https://www.bobvila.com/articles/best-painting-tools/,The Best Painting Tools,The Best Painting Tools - Bob Vila,The Best Painting Tools - Bob Vila,"We've rounded up the best painting tools. Shop our curated list of brushes, accessories, and more to achieve your best paint job yet.","We've rounded up the best painting tools. Shop our curated list of brushes, accessories, and more to achieve your best paint job yet."
https://www.bobvila.com/articles/best-track-saw/,The Best Track Saws,The Best Track Saws - Tested by Bob Vila,The Best Track Saws - Tested by Bob Vila,,
https://www.bobvila.com/articles/best-palm-sander/,"The Best Palm Sanders, Tested","The Best Palm Sanders, Tested - Picks from Bob Vila","The Best Palm Sanders, Tested - Picks from Bob Vila",,
https://www.bobvila.com/articles/best-moisture-meter/,"The Best Moisture Meters, Tested and Reviewed","The Best Moisture Meters, Tested & Reviewed %%sep%% Picks by %%sitename%%","The Best Moisture Meters, Tested & Reviewed %%sep%% Picks by %%sitename%%",,
https://www.bobvila.com/articles/best-emergency-radio/,"The Best Emergency Radios, Tested",The Best Emergency Radios - Tested by Bob Vila,The Best Emergency Radios - Tested by Bob Vila,,
https://www.bobvila.com/articles/best-hand-crank-radio/,"The Best Hand-Crank Radios, Tested and Reviewed","The Best Hand-Crank Radios, Tested - Top Picks from Bob Vila","The Best Hand-Crank Radios, Tested - Top Picks from Bob Vila",,
https://www.bobvila.com/articles/best-portable-tool-box/,"The Best Portable Tool Boxes, Tested",The Best Portable Tool Boxes - Tested by Bob Vila,The Best Portable Tool Boxes - Tested by Bob Vila,,
